title,body,subreddit,post_id
AskScience AMA Series: Happy World Breastfeeding Week! We are human milk and lactation scientists hailing from a range of clinical and scientific disciplines. Ask Us Anything!,"Hi Reddit! We are a group of lactation/human milk/breastfeeding researchers. In honor of [World Breastfeeding Week](https://www.who.int/campaigns/world-breastfeeding-week/2024), we are here to answer your burning questions about babies, boobs, and breastmilk!

Lactation science is fraught with social complexity. In recent years, tensions between [researchers](https://theconversation.com/breastfeeding-research-improves-lives-and-advances-health-but-faces-conflicts-151820), advocates & [industry](https://www.thelancet.com/series/Breastfeeding-2023) have reached a crescendo that impacts both our work and the lived experiences of breastfeeding families. We believe that this science belongs to everyone, and that engaging the public on this topic is an important part in addressing these challenges. Science should never make anyone feel bad, but instead should inspire awe and curiosity!

World Breastfeeding Week is a global event held in the first week of August every year, supported by WHO, UNICEF and many government and civil society partners. The theme for 2024 is ""Closing the gap: Breastfeeding support for all."" WBW celebrates ALL breastfeeding journeys, no matter what it looks like for you, while showcasing the ways families, societies, communities and health workers can have breastfeeding parents' backs. In recent years, public health experts have been moving from simply ""promoting"" breastfeeding toward ""protecting, promoting, and supporting"" breastfeeding-that is, emphasizing the role of the entire community in creating the conditions that make breastfeeding easier, more accessible, and sustainable for all families who want it.

Today's group hails from biochemistry, epidemiology, microbiology, neonatology, family medicine, nursing, epigenetics, and biological anthropology. We can answer your questions in English, Portuguese, Italian, Farsi, Sinhalese, and Hindi.

We will join from **11-2pm CST / 12-3pm EST (16-19 UT)**. Ask us anything!

**Today's panelists:**

+ **Raha Afshariani, M.D., IBCLC, ALC (/u/Quiet_Square_2570)** is a pediatrician, board-certified lactation consultant, Advanced Lactation Consultant (Academy of Lactation Policy and Practice), and is the Special Project Director for the Canadian Lactation Consultant Association. Dr. Afshariani was a lecturer at Shiraz University for 12 years. She is a passionate advocate of community-based breastfeeding promotion. She is founder of R and R Consulting, which guides and educates breastfeeding families, with emphasis on both parental roles.
+ [**Meghan Azad, Ph.D.**](https://umanitoba.ca/medicine/department-pediatrics-and-child-health/faculty-staff/meghan-azad) **(/u/MilkScience)** is a biochemist and epidemiologist who specializes in human milk composition and the infant microbiome. Dr. Azad holds a Canada Research Chair in Early Nutrition and the Developmental Origins of Health and Disease. She is a Professor of Pediatrics and Child Health and director of the [THRiVE Discovery Lab](https://www.thrivediscovery.ca/thrive-lab-members.html) at the University of Manitoba. She co-founded the Manitoba Interdisciplinary Lactation Centre ([MILC](http://www.milcresearch.com)), and directs the International Milk Composition Consortium (IMiC). Check out this short [video](https://www.youtube.com/watch?v=nQvGf5VMtaU) about her research team, her recent appearance on the [Biomes podcast](https://www.youtube.com/watch?v=n0cbLQamg2M&ab_channel=Dr.RuairiRobertson), and her lab's [YouTube Channel](https://www.youtube.com/channel/UCpypSOOa2I1LxJp7KN_4zKw).  
Twitter/X: [@MeghanAzad](https://twitter.com/MeghanAzad)  
+ **Emma Bhakuni (/u/EmmaBhakuni)** is a Neonatal Clinical Support Worker with South Warwickshire NHS Foundation Trust in the UK. She has 11 years experience working between maternity and neonatal care in different NHS trusts, where she has spent a lot of time providing practical breastfeeding support to new families. She has experience with both full term and premature neonates. She is also a student at the University of Cambridge where she is currently studying towards her medical degree.
+ **Bridget McGann (/u/BabiesAndBones)** is an anthropologist who studies lactation as a biocultural system, and how it shaped us as a species. She is a research assistant and science communicator at [THRiVE Discovery Lab](https://www.thrivediscovery.ca/thrive-lab-members.html). She was a founding team member at March for Science (along with /u/mockdeath!). She has a BA in Anthropology from Indiana University, and is a Masters student in Biological Anthropology at the University of Colorado Denver. Check out her [stand-up act about Luke Skywalker's green milk](https://youtu.be/v4PRiBEjq7k?si=pi5aSU6c9MCODpz2), [a thing she wrote about breastfeeding controversies](https://raisingwonder.wordpress.com/2019/08/08/its-time-to-talk-about-the-breastfeeding-science-backlash-movement/), and some of her [top comments](https://www.reddit.com/user/babiesandbones/comments/?sort=top).  
Twitter/X and BlueSky: [@bridgetmcgann](https://twitter.com/bridgetmcgann),  [bridgetmcgann](https://bsky.app/profile/bridgetmcgann.bsky.social)  
Instagram: [@Raising\_Wonder](https://www.instagram.com/raising_wonder/)  
TikTok: [@raisingwonder](https://www.tiktok.com/@raisingwonder)  
+ **Karinne Cardoso Muniz, M.D. (/u/KarinneMuniz)** is a neonatologist and graduate student in Pediatrics and Child Health (MSc.) at the University of Manitoba. Dr. Cardoso Muniz worked as a dedicated doctor specializing in Neonatology and as a coordinator for the Society of Pediatrics in Brasilia, Brazil, specifically for the Neonatal Resuscitation Program. Throughout her clinical career, she has passionately witnessed and promoted breastfeeding and use of human milk in improving health outcomes of both full-term and premature infants. [Here is a lecture](https://youtu.be/JT21ayIbo2E?si=sXC350G2jyabxLcf) she gave in Portuguese about newborn resuscitation.
+ [**Ryan Pace, Ph.D.**](https://health.usf.edu/nursing/research/researchers/ryan-pace) (**/u/_RyanPace_**) is an Assistant Professor and Assistant Director of the Biobehavioral Lab at the College of Nursing and USF Health Microbiomes Institute, University of South Florida. His research revolves around understanding how lactation and the microbiome relate to human health and development. Dr. Pace's current research investigates diverse aspects of maternal-infant health, including relationships among maternal diet, human milk composition, and maternal/infant microbiomes; as well as the role of human milk in modulating immunological risks and benefits to mothers and infants.  
Twitter/X: [@Dr_RyanPace](https://twitter.com/Dr_RyanPace)  
[LinkedIn](https://www.linkedin.com/in/ryan-pace-32628867/)  
[Google Scholar](https://scholar.google.com/citations?user=MyeezIIAAAAJ&hl=en)
+ **Christina Raimondi, M.D., CCFP, FCFP, IBCLC, PMHC, NABBLM-C (/u/Frozen_lemonada)** is a family doctor and a pioneer in breastfeeding and lactation medicine. Dr. Raimondi is a founding member of the [North American Board of Breastfeeding and Lactation Medicine (NABBLM)](https://nabblm.org/) which last year launched, for the first time, a branch of medicine dedicated to lactation. (Yep, for the first time.) She is also a Co-Founder/CEO at the [Winnipeg Breastfeeding Centre](http://wpgbreastfeedingcentre.com/). To learn more about Dr. Raimondi's work, check out [this podcast episode](https://www.youtube.com/watch?v=rOmvecQmTOg&ab_channel=WellthyMD) (30 min) and this [YouTube video](https://www.youtube.com/watch?app=desktop&v=eSCGdjBROfo&ab_channel=DoctorsManitoba) (2 min) featuring her and her collaborator Katherine Kearns.  
Instagram: [@mbmilkdocs](https://www.instagram.com/mbmilkdocs/)  
Twitter/X: [@ChristinaRaimo6](https://twitter.com/christinaraimo6)  
+ [**Sanoji Wijenayake**](https://www.wijelab.ca/team/dr-wijenayake/)**, Ph.D. (/u/Wijenayake\_Lab)** is a cell and molecular biologist, who studies human milk not as a food but as a **_bioactive_** regulator of postnatal development and growth. Dr. Wijenayake is an Assistant Professor and Principal Investigator at The University of Winnipeg. Her research focuses on a not-so-well known component of human milk, called milk nanovesicles. Milk nanovesicles are tiny fat bubbles that carry all sorts of important material between parents and their children. Milk nanovesicles hold great therapeutic potential as drug carriers and provide universal anti-inflammatory benefits.  
[www.wijelab.ca](http://www.wijelab.ca)  
[LinkedIn](https://www.linkedin.com/in/sanoji-wijenayake-ph-d-59040045/)  
Twitter/X: [@DrSanoji](https://twitter.com/drsanoji)

----------

EDIT: THANK YOU for your thoughtful questions everybody!! We learned a lot, and had SO MUCH FUN! A few of us commented to each other how thoughtful and informed the questions were! When you spend a lot of time with a topic every day, it’s easy to get a bit up in your head about it, so this was really helpful for us to take a step back and get a sense of what the wider public is thinking about with regards to our work. You gave us a lot to think about, and even got us thinking about future research questions to pursue!  

Some of us will hang back a bit past our “official” end time (3PM EST), and some of us will pop in out throughout the rest of the day and answer any stragglers.

World Breastfeeding Week continues through the 7th (Wed), but that won’t be the end of what is a more than month-long party!  
  
+ August 8-14th: [Indigenous Milk Medicine Week](https://www.indigenousmilkmedicinecollective.org/milkmedicineweek)
+ ​​August 15-21: [Asian American, Native Hawaiian, & Pacific Islander Breastfeeding Week](https://californiabreastfeeding.org/aanhpi-breastfeeding-week-2023/)
+ August 25-31: [Black Breastfeeding Week](https://blackbreastfeedingweek.org/) (BBW)
+ September 3-9: [Semana de la Lactancia Latina](https://www.facebook.com/Latinxbreastfeedingweek)",askscience,1ei75mx
"Why does the flame of a cigarette lighter aid visibility in a dark room, but the flame of a blowtorch has no effect?",,askscience,c3w9d8
How did scientists know the first astronauts’ spacesuits would withstand the pressure differences in space and fully protect the astronauts inside?,,askscience,b9y8ct
"eli5: How comes when you buy vitamins separately, they all come in these large capsules/tablets, but when you buy multivitamins, they can squeeze every vitamin in a tiny tablet?","Edit: Thanks for all the replies, didn’t expect such a simple question to blow up. To all the people being mad for no reason, have a day off for once.",explainlikeimfive,jvqdzo
ELI5: What is the pattern to orchestral flute fingerings???,"Hello! I have recently acquired an orchestral flute. And as I think plain memorization of what fingering equals what letter note is stupid, along with sheet music, I need to figure out how on earth the buttons on this flute work, since they clearly are not incremental (or whatever the word is) so that I can play by ear/mimic tunes.

I feel like I'm just trying random shit and getting random notes and I need to know how they work so I can see the patterns and figure it out for myself.

THANK YOU!!!

Ps: I think the answer will probably involve physics of wind or something so thus the tag",explainlikeimfive,1j5gcej
"Why do dogs have such extreme diversity in size, shape, and attributes when compared to cats?",Domestic dogs have an extreme amount of variety when compared to domestic cats.  Why?,askscience,fior9n
How did the SARS 2002-2004 outbreak (SARS-CoV-1) end?,"Sorry if this isn't the right place, couldn't find anything online when I searched it.",askscience,gbquds
"ELI5: Why, although planes are highly technological, do their speakers and microphones ""sound"" like old intercoms?","EDIT: Okay, I didn't expect to find this post so popular this morning (CET). As a fan of these things, I'm excited to have so much to read about. THANK YOU!",explainlikeimfive,nliql6
eli5 Why does down syndrome cause an almost identical face structure no matter the parents genes?,Just curious,explainlikeimfive,rb6jv5
ELI5: why does the body always wake up so early after a night of drinking?,,explainlikeimfive,jzgznb
"ELI5 how calculators actually calculate things, and how we know that the answers we get are accurate.",,explainlikeimfive,1j5duch
ELI5: Why can you HEAR the sound of tap water changing temperature?,"Turn on hot water. It starts cold. When it finally gets warm, you can *hear* the change. Why?",explainlikeimfive,ab2ncv
What are the most commonly accepted theories of consciousness among scientists today?,,askscience,i8u481
"If there is indeed microbial life on Venus producing phosphine gas, is it possible the microbes came from Earth and were introduced at some point during the last 80 years of sending probes?","I wonder if a non-sterile probe may have left Earth, have all but the most extremophile / adaptable microbes survive the journey, or microbes capable of desiccating in the vacuum of space and rehydrating once in the Venusian atmosphere, and so already adapted to the life cycles proposed by [Seager et al., 2020](https://arxiv.org/abs/2009.06474)?",askscience,ixaqe9
ELI5: Why is food residue so hard to flush?,"Particularly leafy vegetable type of foods? I've noticed everytime I take a dump and I've eaten something leafy prior, some of the greens come out intact instead of as poo. Then it's such a PITA when I try to flush them, probably takes about 2 to 4 flushes on average until they go down the drain for good. Can someone explain the physics behind this? Can't be anything wrong with my toilet; I don't consider the flushing particularly weak. Definitely not as strong as an industrial type (the type you would find in a good office) toilet but the pressure is strong enough that the poo is usually flushed down in one go. ",explainlikeimfive,1jazzso
ELI5:How after 5000 years of humanity surviving off of bread do we have so many people within the last decade who are entirely allergic to gluten?,,explainlikeimfive,6efne8
ELI5: Why do soldiers still learn to march even though that it’s not practical in actual combat,,explainlikeimfive,d1dj51
Why do they say not to put a car battery on a concrete floor?,The old wive's tale has been proven anecdotally that putting a car battery on a concrete floor kills the charge. Is there any science behind this or is it coincidental? ,askscience,5putlx
Which birds have hollow bones? Did dinosaurs have hollow bones?,"Briefly went down a rabbit hole when I asked twitter “so if you’re a ‘birds aren’t real’ person, are chickens included in that statement?”

And then I saw a post of a dinosaur depicted with feathers/more bird like, and started wondering if dinosaurs also had hollow bones. What I’ve found so far is that birds that have hollow bones have heavier skeletons due to increased bone density despite the “air pockets” (ie a 2oz bird and a 2oz mouse, the birds skeleton would be heavier). Also that it’s not every bone that’s hollow and that diving birds have fewer hollow bones in comparison to birds that rely more on flight. But yeah, this just piqued my curiosity.",askscience,1eedtdx
ELI5: What are binaural beats and solfeggio tones? And how can they (supposedly) impact your brain?,"I noticed these two audio options in my meditation app but can’t quite understand what they are or how they can supposedly help during meditation. 

Not concerned with whether or not they actually do anything or if it’s pseudoscience yet. Just want to understand what they are. ",explainlikeimfive,1j3ni1a
"ELI5: The universe is made up of atoms which are made out of subatomic particles which are in turn made up of quarks. Do we know if this daisy chain stops, or, like a true five-year old, will be always be asking “and then what?”",,explainlikeimfive,b6l3g7
What caused the growing whining sound when old propeller planes went into a nose dive?,"I’m assuming it has to do with friction somewhere, as the whine gets higher pitched as the plane picks up speed, but I’m not sure where.

Edit: Wow, the replies on here are really fantastic, thank you guys!

TIL: the iconic ""dive-bomber diving"" sound we all know is actually the sound of a [WWII German Ju87 Stuka Dive Bomber](https://en.wikipedia.org/wiki/Junkers_Ju_87). It was the sound of a siren placed on the plane's gear legs and was meant to instil fear and hopefully make the enemy scatter instead of shooting back.

[Here's some archive footage](https://youtu.be/5uvqhA4_2tU) \- thank you u/BooleanRadley for the link and info

Turns out we associate the sound with any old-school dive-bombers because of Hollywood. This kind of makes me think of how we associate the sound of [Red Tailed Hawks](https://www.youtube.com/watch?v=NVBxLXyleyQ) screeching and calling with the sound of Bald Eagles ([they actually sound like this](https://youtu.be/PQ2uMauyBow?t=35)) thanks to Hollywood.

&#x200B;

Thank you u/Ringosis, u/KiwiDaNinja, u/BooleanRadley, u/harlottesometimes and everyone else for the great responses!

Edit 2: Also check out u/harlottesometimes and u/unevensteam's replies for more info!

u/harlottesometimes's [reply](https://www.reddit.com/r/askscience/comments/acvkte/what_caused_the_growing_whining_sound_when_old/edbaowx)

u/unevensteam's [reply](https://www.reddit.com/r/askscience/comments/acvkte/what_caused_the_growing_whining_sound_when_old/edbanoz)

&#x200B;

Edit 3: The same idea was also used for [bombs](https://www.youtube.com/watch?v=xa0KMNgbp5E). Thank you u/Oznog99 for the link!",askscience,acvkte
Is it possible a big wave to occur at the same time every day at the beach?,"I’m in Greece at a beach by Athens and every day at 2:54pm there has been an abnormally big wave arriving and going past the first few rows of umbrellas. Anyone know why this happens? Is this some sort of natural phenomenon? 

",askscience,1f9kq4l
"If you are in water right underneath the moon and the moon is at it's closest, do you float better than other places on earth?",,askscience,ey7uja
ELI5: Why is it that you can keep a house phone on it's charging dock for years and it doesn't destroy the battery where as a cellphone will eventually wither over just a couple years if you charge it for too long everyday?,,explainlikeimfive,iquiso
ELI5 Why they dont immediately remove rubble from a building collapse when one occurs.,,explainlikeimfive,o7lnhr
"I imagine seals, dolphins and other sea mammals drink seawater, how good are their kidneys?",,askscience,i70i8f
"If Tesla was on the path of making electricity be conducted through air, like WiFi, how come we can't do it now since technology advanced so much?","Edit: how about shorter distances, not radio-like? Let's say exactly like WiFi, in order for me to charge my phone even when I'm 5 meters away from the charger? Right now ""wireless"" charging is even more restraining than cable charging.",askscience,o5iqml
A chicken egg is 40% calcium. How do chickens source enough calcium to make 1-2 eggs per day?,"edit- There are differing answers down below, so be careful what info you walk away with. One user down there in tangle pointed out that, for whatever reason, there is massive amounts of misinformation floating around about chickens. Who knew?",askscience,l8xdv7
ELI5: Why do snipers need a 'spotter'?,,explainlikeimfive,74f9nn
"ELI5 What keeps bed bugs in check? Why haven't they taken over the world? Do they have any natural enemies? They seem pretty unstoppable - easy breeders, can live a long time without food, can survive harsh conditions, easy hitch hikers, and they feed on an endless supply of human blood.",,explainlikeimfive,av4u27
"ELI5:When you're asleep, what part of the brain filters the noises you hear, determining whether to wake up or not?",,explainlikeimfive,5rttb1
"If for some reason you have a handful of feces in your hand and you wash it off with disinfectant soap but your hand still smells like feces, does that mean your hand is still contaminated?",,askscience,aqyjdm
How does soldering and actually work?,How does soldering something in a motherboard actualy sends the information to the board,askscience,1f59i60
ELI5:How do we know how hot the core of the Earth is and everything underground if the farthest we have dug a hole is just 8 miles?,,explainlikeimfive,7a05al
"ELI5: If all human cells replace themselves every 7 years, why can scars remain on you body your entire life?",,explainlikeimfive,7j18sc
"ELI5: Why are metals smelted into the ingot shape? Would it not be better to just make then into cubes, so they would stack better?",,explainlikeimfive,ok2a78
"What has made solar energy so much more expensive in the past, and what developments are most important to further reduce the cost in the future?",,askscience,5kggms
ELI5: How was a new organ JUST discovered?,"Isn't this the sort of thing Da Vinci would have seen (not really), or someone down the line?


Edit: Wow, uh this made front page. Thank you all for your explanations. I understand the discovery much better now!",explainlikeimfive,887abh
ELI5: How did plants reproduce before pollination?,,explainlikeimfive,1j6x1oc
What is the ecological impact of toilet paper?,,askscience,9w4iyv
Changing state of matter using degeneracy pressure?,"If covalent bonds can be thought of as springs. Then, can we compress the bonds together such that the repulsion cause by the electron degeneracy pressure causes the covalent bonds to release quickly and break like a spring? Furthermore, how could we generate such pressures if this notion is conceivable at least in theory? Thankyou!",askscience,1f9v0zs
ELI5: how does rabies make a human hate water,? ,explainlikeimfive,1j9huhv
"ELI5: Why is it healthy to strain your heart through exercise, but unhealthy to strain it through stress, caffeine, nicotine etc? What is the difference between these kinds of cardiac strain?",,explainlikeimfive,uwl3ib
ELI5 - ADHD brains are said to be constantly searching for dopamine - aren't all brains craving dopamine? What's the difference?,,explainlikeimfive,y44mca
ELI5: Why do single-engine propeller aircraft with dihedral or gull wings self-right even when trimmed to maintain a lazy banking turn to loiter over an area?,,explainlikeimfive,1ja30bq
Can you use a regular compass on Mars?,,askscience,b0d7in
From my 7 year old: Do the things in our bodies ever get tired? Like cells and antibodies? Do they have to rest?,,askscience,rgyvwm
"ELI5: Can someone help translate what's been called ""the most beautiful paragraph in physics""?","Here is the paragraph:

>If one wants to summarize our knowledge of physics in the briefest possible terms, there are three really fundamental observations: (i) Spacetime is a **pseudo-Riemannian manifold** *M*, endowed with a **metric tensor** and governed by geometrical laws. (ii) Over *M* is a **vector bundle** *X* with a **non-abelian gauge group** *G*. (iii) **Fermions** are sections of **(Ŝ +⊗VR)⊕(Ŝ ⊗VR¯)(Ŝ+⊗VR)⊕(Ŝ⊗VR¯)**. ***R*** and ***R*****¯** are not **isomorphic**; their failure to be **isomorphic** explains why the light fermions are light and presumably has its origins in representation difference Δ in some underlying theory. All of this must be supplemented with the understanding that the geometrical laws obeyed by the **metric tensor**, the **gauge fields**, and the **fermions** are to be interpreted in quantum mechanical terms.  
>  
>Edward Witten, ""Physics and Geometry""

According to Eric Weinstein (who I know is a controversial figure, but let's leave that aside for now), this is the most beautiful and important paragraph written in the English language. You can watch him talk about it [here](https://youtu.be/vdW9XDBuxjU?t=3079) or take a deep dive into his [Wiki](https://theportal.wiki/wiki/Graph,_Wall,_Tome).

Could someone (1) literally translate the paragraph so a layman can grasp the gist of it, switching the specific jargon **in bold** with simplified plain English translations? Just assume I have no formal education in math or physics, so feel free to edit the flow of the paragraph for clarity's sake. For example, something like:

>If one wants to summarize our knowledge of physics in the briefest possible terms, there are three really fundamental observations: (i) Spacetime is a ~~pseudo-Riemannian manifold~~ ***flexible*** ***3-dimension space*** *M*, endowed with a ~~metric tensor~~ **composite list of contingent quantities** and governed by geometrical laws... etc.

And (2) briefly explain the importance of this paragraph in the big picture of physics?",explainlikeimfive,ga39ic
What happens to your voice if you don't speak for a very long time?,"I'm writing a story and a woman in the story is unfrozen after 2000 years, not speaking for that amount of time obviously. I was wondering if your voice would be completely gone due to that or if your voice would just be really hoarse?",askscience,bw78ym
What are we currently doing to combat the year 2038 problem?,,askscience,abhuvd
"How much do we know about the ""carrying capacity"" of various dinosaur species?","I.e. how many T Rex were living on the earth at the same time, or how many Ultrasaurs could an area the size of south america have supported? Do we have a decent way of guesstimating that?",askscience,1dvhiks
