title,body,subreddit,post_id
ELI5: Where do those extra four minutes go every day?,"The Earth fully rotates in 23 hours and 56 minutes. Where do those extra four minutes go??

I know the answer is supposedly leap day, but I still don’t understand it from a daily time perspective. 

I have to be up early for my job, which right now sucks because it’s dark out that early. So every day I’ve been checking my weather app to see when the sun is going to rise, and every day its a minute or two earlier because we’re coming out of winter. But how the heck does that work if there’s a missing four minutes every night?? Shouldn’t the sun be rising even earlier, or later? And how does it not add up to the point where noon is nighttime?? 

It hurts my head so much please help me understand.",explainlikeimfive,lkfesf
ELI5: Why is that if you fall asleep hungry you still wake up feeling more or less fine?,,explainlikeimfive,c71z22
"ELI5: How could Germany, in a span of 80 years (1918-2000s), lose a World War, get back in shape enough to start another one (in 20 years only), lose it again and then become one of the wealthiest country?","My goddamned country in 20 years hasn't even been able to resolve minor domestic issues, what's their magic?

EDIT: Thanks to everybody for their great contributions, be sure to check for buried ones 'cause there's a lot of good stuff down there.
Also, [u/DidijustDidthat](http://www.reddit.com/user/DidijustDidthat) is totally NOT crazy, I mean it.",explainlikeimfive,2mp3qh
ELI5: what is a hedge-fund?,"I’ve been trying to follow the Wall Street bets situations, but I can’t find a simple definition of hedge funds. Help?",explainlikeimfive,l6ptb7
ELI5 do tanks actually have explosives attached to the outside of their armour? Wouldnt this help in damaging the tanks rather than saving them?,,explainlikeimfive,t3h7i0
ELI5: someone please explain Standard Deviation to me.,"First of all, an example; mean age of the children in a test is 12.93, with a standard deviation of .76.

Now, maybe I am just over thinking this, but everything I Google gives me this big convoluted explanation of what standard deviation is without addressing the kiddy pool I'm standing in.

Edit: you guys have been fantastic! This has all helped tremendously, if I could hug you all I would.",explainlikeimfive,mexgnw
Why do we use CO2 for sparkling drinks rather than any other gas?,Just curious.,askscience,i2z50x
"ELI5: what is the reason that almost every video game today has removed the ability for split screen, including ones that got famous and popular from having split screen?",,explainlikeimfive,6o4cgc
ELI5: Why and how does alcohol withdrawal cause seizures?,Saw a video of someone going through alcohol withdrawal shaking violently.,explainlikeimfive,1j46whd
"Are there viruses that infect, reproduce, and spread without causing any ill effects in their hosts?",,askscience,fs0drs
ELI5: How is that Alcohol 70% is better than Alcohol 90% as disinfectant ?,,explainlikeimfive,erfec8
"Im wondering as to why all the Birds ,Insects and Fish were very large back in the mesozoic age compared to what they are now?",Why are they much smaller today ?,askscience,b6v02u
What does it feel like walking in areas with high radiation? Does it feel hot or something? Does it smell? Harder to breathe? Or is the only way you will figure it out (w/out a Geiger meter) is when you start to get sick?,EDIT: Sorry for the wrong flair. Not a science guy so I just kind of associated the elements involved with chemistry,askscience,6cgdnn
Could e=mc^2 just be e=m if we used larger units for m?,"E=mc^2 describes the ratio between energy and mass using our current units of energy and mass.

In a hypothetical alien culture where units for mass happened to be c^2 times larger, would they simply arrive at e=m? or is the square of the speed of light fundamentally relevant here?

Thanks!",askscience,1e5x7ba
ELI5 Why are there so many different types of golf clubs in golf?,"When It comes to golf I know there are things like a nine iron, a putter, a sandwidge but while I know there are many different types of golf clubs but can someone please ELI5 why there are so many different kinds and types of golf clubs?",explainlikeimfive,1j7b0k9
"ELI5: How/why is space between the sun and the earth so cold, when we can feel heat coming from the sun?",,explainlikeimfive,pjtcug
When will the earth run out of oil?,,askscience,dur4qo
How do keratinocytes contribute to the innate immune system?,"Hi all,

Just wondering whether someone could help me out - I'd like to know how keratinocytes contribute to the innate immune system. I have tried Google, but couldn't get a straight answer. Any information would be greatly appreciated!

TIA, Mads :)",askscience,1dj2b5u
ELI5: Why do nostril pimples hurt so much more than regular pimples?,,explainlikeimfive,8ebmwb
ELI5: What is 'gaslighting' and some examples?,I hear the term 'gaslighting' used often but I can't get my head around it.,explainlikeimfive,a5p2ca
ELI5: Why does your neck get tense when you’re stressed and how does a massage fix it?,,explainlikeimfive,9o64w8
"When octopus/squid/cuttlefish are out of the water in some videos, are they in pain from the air? Or does their skin keep them safe for a prolonged time? Is it closer to amphibian skin than fish skin?",,askscience,7w632y
Eli5:Why can't we talk in our normal voice while crying?,What contributes to the trembling and chocked up sound of our voices when we cry,explainlikeimfive,jcgcu3
How do we know dinosaurs were reptiles?,"Their only living relatives are birds, and their are already theories that they could have had feathers or looked completely different. Do their bones really tell us that much? Do we actually ""know"" they were reptilian or is it just a theory?",askscience,1d8fkhf
"Is gravity weaker on the equator just because the radius is larger, or also because of a centrifugal force?","And if a centrifugal force also has an effect, how large is it compared to the difference in radii? ",askscience,6f3qee
"What would happen to me, and everything around me, if a black hole the size of a coin instantly appeared?",,askscience,39woqa
ELI5 why is it so hard to make other CPU cores be used?,"I play a lot of games and one common issue is that some games only use 1-3 out of 10 cores the PC has. Why can't the code be spread along all cores automatically instead of having it be built in the code?        
What is the point of having 10+ cores if anything hardly ever uses all 10 cores simultaneously?",explainlikeimfive,1j6byqx
ELI5: Why is it more difficult to inhale when a force of wind or cold air is hitting your face?,,explainlikeimfive,6qpi4t
"ELI5: Why is armpit sweat much more pungent than sweat from other areas of the body, such as back sweat?",,explainlikeimfive,jkyl3h
What happens to water when it freezes and can't expand?,,askscience,6jkg7l
AskScience AMA Series: We have made the first successful test of Einstein's General Relativity near a supermassive black hole. AUA!,"We are an international team led by the Max Planck Institute for extraterrestrial physics (MPE) in Garching, Germany, in conjunction with collaborators around the world, at the Paris Observatory-PSL, the Universite Grenoble Alpes, CNRS, the Max Planck Institute for Astronomy, the University of Cologne, the Portuguese CENTRA - Centro de Astroﬁsica e Gravitacao and ESO. 

Our observations are the culmination of a 26-year series of ever-more-precise observations of the centre of the Milky Way using ESO instruments. The observations have for the first time revealed the effects predicted by Einstein's general relativity on the motion of a star passing through the extreme gravitational field near the supermassive black hole in the centre of the Milky Way. You can read more details about the discovery here: [ESO Science Release](https://www.eso.org/public/news/eso1825/)

Several of the astronomers on the team will be available starting 18:30 CEST (12:30 ET, 17:30 UT). We will use the ESO account\* to answer your questions. Ask Us Anything!

\*ESO facilitates this session, but the answers provided during this session are the responsibility of the scientists.







",askscience,921mov
"The video game ""Subnautica"" depicts an alien planet with many exotic underwater ecosystems. One of these is a ""lava zone"" where molten lava stays in liquid form under the sea. Is this possible?","The depth of the lava zone is roughly 1200-1500 meters, and the gravity seems similar to Earth's. Could this happen in real life, with or without those conditions?",askscience,7vgwdg
ELI5: Why does an orchestra have many people playing the same instruments? How does it add to the overall performance?,,explainlikeimfive,m8u1er
"Since light stops penetrating water at 1000 meters deep and the deepest freshwater lake is 1642 meters deep(both according to Google), is there an equivalent to deep sea creatures for freshwater?",I couldn't find anything on Google.,askscience,7sewfa
If you jump into a volcano filled with flaming hot magma would you splash or splat?,,askscience,9tsbem
Why aren’t all black holes the same size? ,"So a black hole is a point of infinite density where the curvature of space time has approached infinity. If infinity has only one value (which is infinity) then why are there black holes of different sizes and masses? 

I understand that larger black holes may have consumed more mass than other black holes but if the spacetime curvature in a black hole always approaches infinity, shouldn’t they all be the same size?  ",askscience,1ecinpo
Has the amount of natural Carbon 14 deposition in organisms changed over time?,"As with the passage of deep time the sun became more active and has a greater irradiance, this means that the amount of light/radiation that the earth received also increased over time.

Because of this the atmosphere receives more radiation, then, the amount of nitrogen that becomes carbon 14 and is deposited in living beings also increased over time?

Taking into account that the carbon 14 deposited in the current and ancient organism has the same ''age'' at the time of the animal's death in their respective periods.",askscience,1edi3m7
ELI5: How do seeds know which way is up?,"So I was doing some gardening with my 9yo daughter and we moved on to planting some seeds. She was studying them carefully before dropping them into the holes in the compost. I asked her why and she said that she was trying to make sure she planted them the right way up, otherwise they wouldn't grow upwards and flower.

As cute as it is, this got me thinking... How does a seed know which way is the right way to grow?",explainlikeimfive,69sb1q
"At the heat death of the universe, will most black holes eventually merge due to the incredibly long timescale before they evaporate from Hawking radiation, or will most black holes not merge due to the sheer vastness of space between them?",,askscience,afk6xy
"Given that radiowaves reduce amplitude according to the inverse square law, how do we maintain contact with distant spacecraft like Voyager 1 & 2?",,askscience,gwzute
"ELI5: Why is it appropriate for PG13 movies/shows to display extreme violence (such as mass murder, shootouts), but not appropriate to display any form of sexual affection (nudity, sex etc.)?",,explainlikeimfive,5uhr0x
How does a video game or software randomly decide something?,"I've been wondering this for a long time and has never really found an answer to this.

When a game has a certain percentage chance of getting a critical hit for instance, how does it decide wether or not give you one? I don't quite understand how a computer can just randomly decide something without having a real conscience. It's not like in real life where you can flip a coin or something, it has to have a certain pattern instead, right?
",askscience,7law0k
ELI5: Why do exothermic reactions not break the laws of Thermodynamics?,,explainlikeimfive,1j5z2te
"When the atmospheric oxygen content increased ~3.5 billion years ago, where did that oxygen come from and did it replace another gas or did it just increase the mass of the atmosphere?","In the present, to my understanding, oxygen in the atmosphere is produced by plants, which do so using carbon dioxide, and that phytoplankton were the primary cause of the massive jump in atmospheric oxygen content that happened during the Archean. My question, is that given that there were basically only single celled organisms on earth, where did the oxygen come from in the first place? Is it bonded in rocks and trapped in the crust, and the phytoplankton were able to free it? Was it dissolved in the ocean? Was it somehow transported from another part of the galaxy such as in an meteor? Was there significantly more carbon dioxide in the atmosphere? And if there was carbon dioxide, where did that come? Were there mono cellular organisms on earth already undergoing cellular respiration, and if so, where did they get the oxygen to do so in the first place? ",askscience,1emy3cc
Does oxygen load onto haemoglobin sequentially or simultaneously?,"Conflicting messages in the textbooks on this one. I understand that co-operative binding occurs, resulting in each sequential O2 bound to the Hb tetramer to be easier to add than the previous. However, both the following seem plausible to me as a consequence of this phenomenon:

1. Hypothesis 1: the majority of haemoglobin exists fully-saturated oxyhemoglobin or fully-desaturated deoxyhaemoglobin, with % saturations being based on a ratio of the two. This is because oxygen will preferentially bind to haemoglobin molecules which have already overcome the relatively high energy barrier required to bind the first oxygen molecule.
2. Hypothesis 2: the % saturation represents a ratio of amount of oxygen carried by the haemoglobin and the amount that could be carried by the haemoglobin. I.e. a population of Hb molecules at 75% saturation would all contain a distribution of oxygen molecules centred on a mean of 3. Under this hypothesis, only the last (fourth) molecule tends to be loaded at the lungs and unloaded at the tissues. 

So which one is it? Both seem plausible. Both are given as explanations in (different) sources. Only the former seems to be compatible with my understanding of how a pulse oximeter works. ",askscience,1d897gf
"ELIF: Why is restaurant food vastly more calorie dense than preparing food at home? Even at restaurants where they cook everything fresh, the calorie count is insane.",,explainlikeimfive,8s84d7
ELI5: Why do antidepressants cause suicidal idealization?,"Just saw a TV commercial for a prescription antidepressant, and they warned that one of the side effects was suicidal ideation.

Why?  More importantly, isn't that extremely counterintuitive to what they're supposed to prevent?  Why was a drug with that kind of risk allowed on the market?

Thanks for the info

Edit: I mean ""ideation"" (well, my spell check says that's not a word, but everyone here says otherwise, spell check is going to have to deal with it).  Thanks for the correction.",explainlikeimfive,66zkaf
"Since we measure nuclear warhead yields in terms of tonnes of TNT, would detonating an equivalent amount of TNT actually produce a similar explosion in terms of size, temperature, blast wave etc?","Follow up question, how big would a Tzar Bomba size pile of TNT be? (50 megatons)",askscience,a2t0wj
ELI5: Why is around 200C/ 400F the right temperature to cook pretty much everything?,,explainlikeimfive,iyhphu
Why does the moon appear larger and red during moonrise/moonset?,,askscience,1dh8bw9
ELI5: How do pharmaceutical companies get away with advertising and selling medication with fatal side effects like strokes and death?,,explainlikeimfive,1j6mvrk
What caused the carnian pluvial event ? And is it true that it rained for 2 milion years ?,,askscience,1cxae8l
ELI5: How do zip files compress information and file sizes while still containing all the information?,,explainlikeimfive,5kohsr
"ELI5: How do ""hive"" applications get startup users? Apps like tinder, meetup, and other social apps?",,explainlikeimfive,65rjxg
I developed seasonal allergies when I was 33. How does my body decide that things it has encountered for decades are now hostile?,,askscience,t80gok
"if you were in a swimming pool on the moon, would you be less buoyant, more buoyant, or the same?",,askscience,1ec60uu
ELI5: How can electrons exist without being made of anything else?,"I know that electrons are considered a fundamental particle, and therefore cannot be made of anything else, but how exactly does that work? How can matter be made of nothing ?",explainlikeimfive,1jabnod
ELI5: How does a structural formula in chemistry work?,,explainlikeimfive,1j9xf6u
"ELI5: There’s millions if not billions of creatures in the ocean and they all pee, so how do they not get sick from essentially inhaling each other’s urine?",,explainlikeimfive,cb0jr5
"Why is there no tick prevention for humans? You can buy prevention for dogs that lasts for months without reapplication, but for humans the best we can do is a bug spray that sometimes works.",,askscience,umik09
Is there a difference between hitting a concrete wall at 100mph and being hit by a concrete wall at 100mph?,,askscience,6dtz3i
How are medicines actually produced? ,I assume they're made in some sort of lab using chemical reactions. What I'm more asking is what are the actual resources and how're they procured? I assume the answer is different for different types of medication but I'm curious how something like escatalopram or progesterone pills are made,askscience,1ecfyl7
How much do children's foreign language shows like Dora The Explorer actually help a viewer learn another language?,"Farewell, Aragog, King of the Arachnids.",askscience,akbz8l
ELI5: Why are living 2 headed reptiles so much more common than living 2 headed mammals,,explainlikeimfive,my7huz
ELI5: Why does it take 5 seconds for credit card/debit card companies to take money out of my account but 5 days for them to refund it?,,explainlikeimfive,3hu553
"ELI5: How does your body burn 2000 calories a day, but you have to run a mile to burn 100 extra?",Basically the title. I saw this thing about how much you have to exercise to burn off certain foods and was wondering how your body burns so many calories by doing nothing.,explainlikeimfive,eluost
"If there was a bag of 10 balls, 9 white and 1 red and 10 people including you has to pick one randomly and who gets the red ball wins, does it matter what order you all pick, or is it better to go first or last with probability?",,askscience,8qqp7v
"In 1899 ""Mile-a-Minute"" Charles Murphy set a bicycle world record of 60 mph by riding behind a train to reduce drag, would this approach work for human runners as well to break the elusive 30 mph threshold?","Wow... thanks everyone for the amazing input! If Usain Bolt only knew the amount of scientific brainpower that's been expended on this hypothetical I'm sure he'd be impressed. I wish there were a financial incentive for him to break the 30 mph threshold, he's probably the only human from the last few centuries that can pull it off. ",askscience,5057fv
"Why does every human has a unqiue voice, and how come voice artists are able to replicate other's voice so authentically?","Some follow up questions:

Why do each animal species sound almost similar to us? Why can't we appreciate voice variation in them as can we do in other humans?

And what really happens at puberty that cause male voice to become deeper and not of girls?",askscience,at5mvy
"ELI5: why do appliances like fans have the off setting right next to the highest setting, instead of the lowest?",Is it just how they decided to design it and just stuck with it or is there some electrical/wiring reason for this?,explainlikeimfive,fvdkfx
ELI5: Why does the value of a new car immediately tank once it is driven off of the lot?,Why specifically with cars? Is the value of a brand new car and the value of one that has been driven for a few miles really that different? This doesn't happen with other assets like a house that has been lived in for example.,explainlikeimfive,1j8e5p7
Can insects/spiders get obese?,,askscience,i7xojq
How far do you have to go beneath the ocean floor before the earth becomes dry again?,"If you dig deep enough through the ocean floor, assuming no water backfills your hole, how far until you reach dry crust again? 

Edit: clarification - how far down does the ocean saturate the earths crust. ",askscience,94d77s
"Is it possible to suffer permanent damage if a part of your body ""falls asleep"" for long enough?",,askscience,fj1bea
"ELI5: have languages for animals developed over time similar to that of human beings, or say can a lion in this time communicate with a lion five hundred years ago?",,explainlikeimfive,cg858k
"ELi5: When a baby is born, how are their lungs instantly able to breathe air if they haven't been breathing air for 9 months?",,explainlikeimfive,jbz6xb
"If climate change is a serious threat and sea levels are going to rise or are rising, why don’t we see real-estate prices drastically decreasing around coastal areas?",,askscience,dlh4kv
"ELI5: There are many programming languages, but how do you create one? Programming them with other languages? If so how was the first one created?",Edit: I will try to reply to everyone as soon as I can.,explainlikeimfive,gy8fyo
"From an evolutionary standpoint, how on earth could nature create a Sloth? Like... everything needs to be competitive in its environment, and I just can't see how they're competitive.",,askscience,10zzzhl
"If you were to fall down a skyscraper's elevator shaft, would the Coriolis effect cause you to hit the sides?",,askscience,9t3wnx
What is the approximation population of the giant Squid?,"I've just learnt that there are about 300,000 Sperm Whales in existence, and before the Whaling industry, it used to be 1.1 million. And I also know that about 10% of Sperm Whale diet by weight is supposed to be Giant Squids? Wouldn't that be like 2-3 digits millions of Giant Squid are eaten by Sperm Whales per year? Is my approximation somehow be way off? If it's not how does the Squids even find that much food to grow to that size in the millions?",askscience,1ep5y2q
ELI5: why can't we get a yearly full body MRI to scan for cancers?,"
I've seen so many horror stories where someone gets sick or is in pain, thinking they know what's causing it only to find out they have late stage cancer.  I don't understand.....wouldn't insurance companies want to offer this like they would a free yearly physical as it would be cheaper for them than paying out cancer treatments? Wouldn't doctors want to push they're patients to have this service done?",explainlikeimfive,1eh6ruy
Tortoiseshell cats: why do we see patterns in mosaic expression?,"Tortoiseshell cats have a different melanin allele on each X chromosome. Why do we see what appear to be lines or patterns of fur coloration? 

One X chromosome is inactivated by Lyonization and becomes a Barr Body, the other is expressed. The expressed melanin allele determines the color of the fur produced by the cell.

When a somatic cell divides, the daughter cells express the *same activated X*, and *suppress the same X in the Barr Body*, so the color of the fur of daughter cells is the same its parent cell. 

So we *shouldn't* expect to see a coat where the fur colors are expressed uniformly at random  from the set of two possible alleles.

We should expect contiguous ""islands"" of coloration, from all spacially adjacent descendent cells divided from the earliest progenitor cells, which progenitors selected an X at random to supress.

*So finally the question: But why do we also see what appear to be lines or patterns?*

 Differential growth rates of the descendent somatic cells? Die offs of certain cell lineages? Is this mostly determined in utero or can it change over the lifetime of the animal?",askscience,1dn2w52
ELI5: what happens to animals who live in the ocean beneath where a hurricane is?,,explainlikeimfive,6yfp2v
"ELI5: Why are other standards for data transfer used at all (HDMI, USB, SATA, etc), when Ethernet cables have higher bandwidth, are cheap, and can be 100s of meters long?",,explainlikeimfive,eqs5re
ELI5: Why is there such an emphasis on not consuming plastics and other harmful products rather than on their manufacture?,The bottle of water (or other product) is already made and therefore it will become a waste product at some point.  Why the emphasis on not consuming it instead of pushing for the reduction of manufacture?,explainlikeimfive,beca3y
"ELI5: How can scavenger animals (that feast on often diseased, rotten flesh) stomach such meals?","What makes their digestive system so unique that they are classified as ""scavengers""?",explainlikeimfive,u0e13j
"ELI5 If boiling water kills germs, aren't their dead bodies still in the water or do they evapourate or something",,explainlikeimfive,rr978k
ELI5: Why exactly is “Jewish” classified as both a race and a religion?,,explainlikeimfive,sidtew
"ELI5: If I were to take a really really really (light years) long stick and push something on the end of it, would it happen “instantly”?",Obviously theoretical but if I took a light year long stick and say pushed a button at the other end would that button be pushed at the same time for me as say someone standing at the button? How does the frame of reference work when physically moving something? And could that “work” as a method of instant communication?,explainlikeimfive,1fesrp8
ELI5:Why aren't we putting a lot more research toward making genetically modified plants/algae/bacteria that consume a lot more CO2?,"Isn't this a legit solution to slow down, stop or reverse global CO2 emissions, and thus, warming?",explainlikeimfive,65v693
