title,body,subreddit,post_id
ELI5: Why is it that when we watch footage from the 70s a lot of times it looks better than footage of the 90s?,"I don't know what it is, but it looks good and sharp despite being pixelated.

Example:

[https://www.youtube.com/watch?v=qFfnlYbFEiE](https://www.youtube.com/watch?v=qFfnlYbFEiE)

&#x200B;

edit: oh shit, this blew up. Thanks for all the answers. I learned a lot! =D",explainlikeimfive,ivd7cz
ELI5: Why are some spicy foods felt in the mouth (i.e. hot sauce) and some felt in the sinuses (i.e. wasabi?,,explainlikeimfive,a0xncr
How do our bones know to grow to be the same length?,"I was discussing this with a friend yesterday, and we were trying to work out how our bones know to grow to be the same length? We were thinking that it could be something about timing the growth, but might there would need to be some sort of feedback mechanism to control whether they are the same length? But then I could see this working in the legs but not the arms.

  
This is all supposing that our bones do grow to be the same length though I suppose..",askscience,1czga5y
ELI5: Types of fiber?,"What holds your crap together, what makes it loose?  What helps you go and stay regular?  What stops the mail?  ",explainlikeimfive,1j8fu34
"ELI5- When you don’t eat for a period of time, why do you sometimes feel nauseous to the point of not wanting to eat anymore?",,explainlikeimfive,cnvbvv
"On Jupiter, will more superstorms the size the Great Red Spot eventually form, or are the positions and types of storms relatively constant?","Hurricanes and big storms on Earth move around and change size, but does that happen on Jupiter?",askscience,6exgpt
Is there a certain priority list for a severely damaged human body to heal itself?,"Does human body have a priority list for healing the body?

For example: if a human body has multiple fractures, severed nerves, multiple lacerated organs, internal bleeding and cuts and bruises, how does the body react to the healing process? Which of the wounds and damaged areas it starts to heal first? 

I am aware of different kinds of shocks and reactions to the human body, but lets cast those aside.

Is it strictly related to DNA only or is there some sort of other mechanisms the body/brain uses?
",askscience,8i6844
"ELI5: If the blue pigment is so uncommon in nature, where did we get the pigment to create paints in times such as the Renaissance",,explainlikeimfive,8z1i1m
"ELI5: Why prices are increasing but never decreasing? for example: food prices, living expenses etc.",,explainlikeimfive,uadovh
ELI5: Why does your body feel physically ill after experiencing emotional trauma?,,explainlikeimfive,6y9qw9
ELI5: Why are arrest records and mugshots made publicly available before a guilty conviction is determined by the courts?,"Wouldn't this paint a picture that the person is guilty before proving his innocence? It's possible that the wrong person was arrested and there is supposedly a presumption of innocence until proven guilty. Also, wouldn't it just create a mob mentality and skew public judgment from a jury perspective?",explainlikeimfive,8kbuio
"Came across this ""fact"" while browsing the net. I call bullshit. Can science confirm?","If you have 23 people in a room, there is a 50% chance that 2 of them have the same birthday.",askscience,3j81fq
ELI5: Major League Baseball batting strategy. Are they simply trying to hit a home run every time? Is there more to it than that?,,explainlikeimfive,69ehab
"Are the symptoms of an illness the illness itself, or your body reacting to it?","I’m listening to The Stand by Stephen King and absentmindedly started wondering about what causes the symptoms of an illness. I want to know if the symptoms are your body’s reactions to the illness, the illness’s reaction to invading and fighting with your body, or a combination of both? 

For instance, the buboes you develop during the bubonic plague, is this a defense mechanism your body constructed to fight off the illness? Like a fever or inflammation? Or is it purely the bacteria’s programmed method of propagating and spreading throughout the body? When I develop the pox, are the pox on my body my body’s doing, or the virus? 

I know this may seem like a silly question, but I’m curious. I figured the subreddit was the best place to get a solid answer. Please and thank you! ",askscience,1etsf2h
"ELI5: Why do Marvel movies (and other heavily CGI- and animation-based films) cost so much to produce? Where do the hundreds of millions of dollars go to, exactly?",,explainlikeimfive,bfxz9t
What’s the difficulty in making a pill that actually helps you lose weight?,"I have a bit of biochemistry background and kind of understand the idea, but I’m not entirely sure. I do remember reading they made a supplement that “uncoupled” some metabolic functions to actually help lose weight but it was taken off the market. Thought it’d be cool to relearn and gain a little insight. Thanks again

EDIT: Wow! This is a lot to read, I really really appreciate y’all taking the time for your insight, I’ll be reading this post probs for the next month or so. It’s what I’m currently interested in as I’m continuing through my weight loss journey.",askscience,kl1wk6
ELI5: How does blood circulate through your body after you've had an amputation?,,explainlikeimfive,64zwwz
eli5: What makes ‘permanent’ markers more permanent than regular markers?,,explainlikeimfive,mmowjo
ELI5: What causes proteins to misfold?,"So, I’m assuming theres a reason why proteins fold the wrong way other than “bad luck oops”. I’m also assuming the body misfolds proteins all the time but has a way to destroy them.

In case it isn’t clear, I’m referring to prions here.

So, what causes proteins to misfold, how does the body destroy a misfolded protein, and at what point does a misfolded protein become a prion and thus becomes at risk for misfolding other proteins? ",explainlikeimfive,1ja88bu
"ELI5: When inside a large group of people (at a stadium, concert, festival), why does your phones internet data stop working despite having full bars? Why does such a large presence of phones in one area limit every phones’ usability and ability to even simply send a text message?",,explainlikeimfive,dl7ve0
What determines the lifespan of a species? Why do humans have such a long lifespan compared to say a housecat?,,askscience,7kq5r4
"Eli5, why does food only release its nutrients if cooked, like say, sprouting beans and stuff. Aren't all the nutrients already there?","It is hard for me to articulate what I mean exactly, but if all the amino acids and whatnot are present, why does changing the processing nature, affect how easy it is to digest?",explainlikeimfive,1j3wbr2
"ELI5 How do RV dealerships really work? Every dealership, it seems like hundreds of RVs are always sitting on the lot not selling through year after year. Car dealerships need to move this year’s model to make room for the next. Why aren’t dealerships loaded with 5 year old RVs that didn’t sell?",,explainlikeimfive,t4dhfr
Why is it so important to finish the whole course of antibiotics?,"Hey guys, so I got into this debate with my friend who told me he stops taking his antibiotics once he starts feeling better. Naturally I was horrified but when he kept questioning it, I couldn’t really explain why it was so important for him to take the full course. Could anyone explain what the dangers are when people don’t finish their prescribed course of antibiotics?

EDIT: thank you so much for all the comments and resources! I’ll pass them on to my friend and hopefully he’ll believe it’s more than just “big pharma propaganda” lol.

EDIT 2: For everyone saying my friend sucks, I completely understand, but my friend is not a scientist. He was ignorant to how antibiotics work and why it was important to keep taking medicine after he stopped feeling sick. I would say his opinion represents the majority of people who don't really think deeply about these things. The ""big pharma propaganda"" argument was a bit stupid, but I'm sure if he was aware of the dangers, he would finish his antibiotics.",askscience,el35q2
ELI5: What actually causes inflation,"The cost of living keeps rising, but what is the actual root cause

You can argue that Company A's cost of raw products which they purchase from Company B increases so they have to increase their prices. Meanwhile Company Bs costs went up on anything they buy from Company C which just repeats on and on.

I am completely lost on what the actual root cause is and I believe a lot of people to be in the same boat but it isn't something we think about because at this point we just accept that the cost of living increases every year. But why does it?",explainlikeimfive,1j5asix
"With all this fuss about net neutrality, exactly how much are we relying on America for our regular global use of the internet?",,askscience,7ez85x
"The freezing point of carbon dioxide is -78.5C, while the coldest recorded air temperature on Earth has been as low as -92C, does this mean that it can/would snow carbon dioxide at these temperatures?","For context, the lowest temperature ever recorded on earth was apparently -133.6F (-92C) by satellite in Antarctica. The lowest confirmed air temperature on the ground was -129F (-89C). [Wiki link to sources](https://en.wikipedia.org/wiki/Lowest_temperature_recorded_on_Earth).

So it seems that it's already possible for air temperatures to fall below the freezing point of carbon dioxide, so in these cases, would atmospheric CO2 have been freezing and snowing down at these times?

Thanks for any input!",askscience,98b7jf
"ELI5: how can our brains remember that we forgot something, but it can't remember what we forgot?",,explainlikeimfive,ggul9k
ELI5 Why do engineers blast through hills instead of building highways over them?,"Can't get back to all the comments, thanks all <3

EDIT: I used HILLS and not MOUNTAINS on purpose lol, c'mon guys I'm not *that* clueless. Tunnels absolutely do not figure into my question. Thank you everyone for answering this has been enlightening.

EDIT 2: I don't think it has occurred to some browsers of this sub that the people asking these questions have probably considered their own question and come up with hypotheses already. Trust me, I had 2 hours longer to drive and think after I posted the question at a gas station haha. ELI5 has confirmed some of my hypotheses about this and also added many new pieces of information to the puzzle which I am grateful for. Some of you taking time out of your day to say ""stupid question"" or something along those lines, please don't consider becoming teachers, and go forth in this sub operating under the assumption that a lot of the questions asked here are not just asked out of curiosity, but also just seeking confirmation of hypotheses before going out into the world and spewing BS lol.",explainlikeimfive,loz0w0
Coronavirus Megathread,"This thread is for questions related to the current coronavirus outbreak.

>The Centers for Disease Control and Prevention (CDC) is closely monitoring developments around an outbreak of respiratory illness caused by a novel (new) coronavirus first identified in Wuhan, Hubei Province, China. Chinese authorities identified the new coronavirus, which has resulted in hundreds of confirmed cases in China, including cases outside Wuhan City, with additional cases being identified in a growing number of countries internationally. The first case in the United States was announced on January 21, 2020. There are ongoing investigations to learn more.

- [CDC](https://www.cdc.gov/coronavirus/index.html)

[China coronavirus: A visual guide - BBC News](https://www.bbc.com/news/world-51235105)

[Washington Post live updates](https://www.washingtonpost.com/world/coronavirus-china-live-updates/2020/01/24/4e678f9c-3e03-11ea-afe2-090eb37b60b1_story.html)

**All requests for or offerings of personal medical advice will be removed, as they're against the /r/AskScience rules.**",askscience,etkdx1
"ELI5: Why can’t you spend dirty money like regular, untraceable cash? Why does it have to be put into a bank?","In other words, why does the money have to be laundered? Couldn’t you just pay for everything using physical cash?",explainlikeimfive,mzsrmj
"ELI5: Why is diesel no longer ""green""?","When I was growing up, diesel was always considered the greener option than petrol, and this was reflected in the prices, diesel always cost less because it was taxed at a lower rate. 

Now they say it's worse than petrol and prices are now higher for diesel. 

So what changed, or what did we suddenly learn about diesel that we didn't know before? 

Bonus question, considering they're both made from crude oil, what's the difference in how they're refined?",explainlikeimfive,lqy0we
ELI5: How do truth tables work?,"I'm kinda stuck on chapter one of ""Discrete Mathematics and its Applications"". I understand bits of the logic, 'and', 'or', 'XOR', and so on. The individual parts make sense, it's just filling them out, is what I'm struggling with. The formatting, translating it to English. The lectures aren't helpful, and the books isn't the best. It's just this little bit I need to connect the dots, then I can do the practice on my own to fully learn this stuff. Any and all help would be appreciated! *Sorry about my grammar, I'm on one brain cell right now*",explainlikeimfive,1j9bgls
Can an american grey squirrel reproduce with an English grey squirrel?,I.e are they still considered the same species or have they been separated long enough that are two different species? ,askscience,1dob2zv
ELI5: How does pee come out so strong?,,explainlikeimfive,1j5jc1v
ELI5: biophysics of snot,"I have a cold.  One symptom is that my nose is stuffed.   

It suddenly went from ""not coming out, no matter how hard you blow"" to ""running like tears down my face"". 

Why?   
Is there any way to induce the thin state when I'm about to blow my nose?  (Admittedly, the thick state is useful when sleeping.)  ",explainlikeimfive,1j9o4n1
How do bacteria targeting vaccines like Pneumovax work?,"I was due for pneumovax today and as I left the clinic I realized ""hey...wait a minute, isn't pneumonia also a bacterial thing?"" before I could ask. Any way I tried reading the wikipedia entry on it and it does indeed safeguard against bacterial strains responsible for pneumonia. I'm not getting any explanation anywhere close to the simplicity of understanding viral vaccines (inactivated and live attenuated) when reading about it. Was just curious, thanks. ",askscience,1ed37cj
Do any other species besides humans bury their dead?,,askscience,a5ioiz
ELI5: How do “hostile takeovers” work? Is there anything stopping Jeff Bezos from just buying everything?,,explainlikeimfive,tx1fpv
ELI5: Does working out for 10 minutes every day do anything or do you have to do a minimum amount of exercise to see any benefit?,"I know obviously more activity is better, I'm just curious if there's a minimum threshold for health benefits.  If someone goes from sitting every day to running 10 minutes every day, will they see improvement or do they need to run/lift/swim etc for an hour?

Edit:. Just to clarify, not looking for advice on how to get myself in shape or anything, just curious about exercise limits and benefits (or lack there of) of small activities",explainlikeimfive,qyhjwz
"Why do clothes feel crunchy when you air dry them, but soft out of the dryer?",,askscience,6xpwcp
"ELI5: Why is the loudest sound ever reported is considered to be the Krakatoa volcanic eruption, at 180 dB and could be directly heard 5,000km away but rocket launches regularly hits 200+ dB but are only heard within the vicinity of the ignition?",,explainlikeimfive,n3vy6t
Why do computers and game consoles need to restart in order to install software updates?,,askscience,7mmz8i
How do third party headphones with volume control and play/pause buttons send a signal to my phone through a headphone jack?,"I assume there's an industry standard, and if so who is the governing body to make that decision? ",askscience,696mv5
ELI5: Why is the rising cost of housing considered “good” for homeowners?,"I recently saw an article which stated that for homeowners “their houses are like piggy banks.” But if you own your house, an increase in its value doesn’t seem to help you in any real way, since to realize that gain you’d have to sell it. But then you’d have to buy or rent another place to live, which would also cost more. It seems like the only concrete effect of a rising housing market for most homeowners is an increase in their insurance costs. Am I missing something?",explainlikeimfive,umuygs
"If SARS-Cov-2 is an RNA virus, why does the published genome show thymine, and not uracil?","Link to published genome [here](https://www.ncbi.nlm.nih.gov/nuccore/NC_045512).

First 60 bases are **attaaaggtt tataccttcc caggtaacaa accaaccaac tttcgatctc ttgtagatct**.",askscience,g08se2
ELI5: why do we have a white half moon at the top of our fingernails?,,explainlikeimfive,i5mhyt
Eli5 how do the ships bear the huge weight of anchor chains for a very deep ocean?,"I have seen the massive anchor chain going down speedily, but how the ship bears the weight of very long chains for deep oceans like 12k feet or so? Couldn't it be a big burden? ",explainlikeimfive,1j82a2c
ELI5: If energy can’t be created or destroyed what happens to it?,"Today, whilst running a hot water tap I started thinking about the energy used to create the hot water. I remembered back to physics - and perhaps I’m remembering it wrong, but energy can’t be created or destroyed, just transferred. So my thought process went along the lines of stored energy in gas is transferred to the water causing it to heat. Thermal energy in the water escapes and enters the room. This heat escapes the building and to the outside. Where would the energy go next and what would its next form be? 

Searching on the internet for an answer gave another ‘where does the energy go’ thought - the example given was a car with stored chemical energy, which is then converted into kinetic energy via the engine to move the car. Where does this energy then go? 

Edit - Thanks for all the answers! Today I learnt that heat is the lowest form of energy and often considered ‘used’ when converted to heat. This heat radiates from the earth to space eventually. ",explainlikeimfive,1jbfe4y
ELI5: If energy cannot be created or destroyed than how does gravity constantly pull things down?,,explainlikeimfive,1j8cwdw
"ELI5: How point systems, like on Snapchat and Reddit, motivate people to participate even though they contribute no tangible value like money or rewards?",,explainlikeimfive,6m4neu
You know how LEDs and solar panels are diodes? ,"What happens if you feed a solar panel energy? Does it light up? I had trouble googling it. I either find LEDs being turned into solar panels, or I can’t find someone dumb enough to ruin solar panels that tested it lol. 

What’s the deal here? Do they emit non visible light? Colors the human mind can’t comprehend? Just curious. ",askscience,1eo5abj
Why didn't the H1N1 Pandemic affect the world as much as COVID-19 did and still is affecting it massively?,,askscience,j8lgfz
Just how swampy was the Carboniferous?,"I know that there was a LOT of swampland during the Carboniferous, but I can't find anything on just how much of the world was swampy at the time. Was it just one big swampland broken up by mountain ranges, or were there other biomes?",askscience,1e9yu5k
ELI5: Why do we tend to listen to a new song that we like over and over again and then we can’t stand hearing it anymore?,,explainlikeimfive,jmayjr
How can we hear the voice in our head and how is it produced?,Edit:Holy crap thanks for all the up votes and info you guys provided.,askscience,6w956o
"ELI5 Why do hamsters (and possibly other rodents too) sometimes freeze, motionless, for seemingly no reason?",,explainlikeimfive,mq2tm0
ELI5:Can someone explain what abstract reasoning is to me?,and how its related to iq.,explainlikeimfive,fberov
ELI5:Why does working a muscle to exhaustion with low weight and high volume vs high weight and low volume yield different results?,"Why wouldn't doing 200 reps of a 10lb dumbbell result in strength and hypertrophy gains, even though i'm doing more stretching and contracting, and still working to exhaustion?

edit: well then, this blew up last night lol. a TON of great replies and a lot of information showing just how much information there is to know and still learn about the human body as most ""truths"" with our physiology are still just accepted theories. Big thank you to u/cthulhubert for the great response, spawning the 3rd best analogy to use midgets that i've ever seen. ",explainlikeimfive,4z1xls
How many times has the average drop of water been through an animal kidney in the history of Earth?,,askscience,dd5s24
I have a theory: If there is an infinite amount of negative numbers and there is an infinite amount of positive numbers then the total amount of numbers would be odd. Because 0 is in the center. For every positive number there is an negative counterpart. Am I right? Can we prove this with math?,,askscience,ea0opz
"How was the Great American Interchange possible, if Panama is known to be impossible to cross?",,askscience,1f9uoog
"AskScience AMA Series: I'm Emily Calandrelli, I have 4 degrees in science and engineering and I'm the host and co-Executive Producer of Emily's Wonder Lab on NETFLIX - AMA!","Hi! I'm Emily Calandrelli. I'm the host and co-Executive Producer of the new Netflix show, Emily's Wonder Lab. My bachelors is in Mechanical and Aerospace Engineering from West Virginia University and I have Masters in Aeronautics and Astronautics as well as Technology and Policy from MIT. I have been working as a science TV show host, children's book author, and public speaker for the last 7 years. AMA!

I'll be on at 2 PM ET (18 UT), AMA!

Username: /u/emilycal",askscience,isiqk1
ELI5: why is it necessary to wipe the skin with an alcohol wipe when receiving any type of injection or having blood drawn but it isn’t necessary for a shot in the mouth?,Edit:  I know why an alcohol wipe is/was necessary when I asked this question. I just used it as a comparison to get across the meaning of the second part of my question. I was just wondering about the mouth injection and thought I’d ask it here. This was actually the first thing I’ve ever posted on Reddit and I didn’t expect such a huge response. Thank you all.,explainlikeimfive,ka3w3z
"ELI5: Didn't the constant RPM playback mechanism of old tapes or records mean that the audio quality got worse as you got towards the ""slower"" end of the recording?",,explainlikeimfive,1j7049t
"Why are some viruses like corona or the flu one and done, while others like herpes or HIV can last your entire life?","Edit: Apparently my phrasing was a little confusing. By one and done I meant ""generally"" you catch the virus like flu, and it's gone from your body in a couple weeks, as opposed to HIV which lasts your life and is constantly symptomatic. I did not mean that it's impossible to catch the flu again.",askscience,hhmcld
ELI5: How can two singers sing the same song in the same key still have distinguishable voices?,"This is actually question my daughter posed and I’m pretty stumped. She asked how, if two people with (let’s say) perfect pitch sing a song, how is it possible that we can still tell who is singing when the notes would be identical?

Note: I know absolutely nothing about music, but figured this was the best place to ask for her.

Edit: Wow, many of these answers are incredible! I had no idea this would receive such in depth and thoughtful feedback. I have learned a huge amount. I was not exaggerating above when I said I know nothing about music (I don’t even know what pitch is - just quoted my daughter on that) and I’m grateful to those of you who took the time to help me learn.",explainlikeimfive,kpxv2g
"Eli5 : After seing the meme of a guy going back in time and unable to answer to the question ""how is this so-called electricity made?"", I'm actually really asking myself the question.",,explainlikeimfive,kxqq97
"ELI5: Why do almost all FM radio frequencies have an odd decimal value? For example: 100.3, 91.5, 101.1",,explainlikeimfive,b3lh5g
Do spiders ever take up residence in abandoned webs?,,askscience,jw9lrt
ELI5 How does ETFs and DCA work?,Hello.I am trying to learn about ETFs and DCA.How does it work?,explainlikeimfive,1j5kq8p
ELI5: What are stock buyback initiative and why do CEOs/companies seem to love them so much?,,explainlikeimfive,1j82l73
"In 'Interstellar', shouldn't the planet 'Endurance' lands on have been pulled into the blackhole 'Gargantua'?","the scene where they visit the waterworld-esque planet and suffer time dilation has been bugging me for a while. the gravitational field is so dense that there was a time dilation of more than two decades, shouldn't the planet have been pulled into the blackhole?

i am not being critical, i just want to know.",askscience,f1r275
Ice burns make no sense to me on a molecular level. Your skin cells are damaged because they came in contact with molecules that move too slowly?,"you can damage your skin via conduction on too hot and too cold objects (-5°C - 54 °C). Now i can somewhat understand how fast moving molecules can damage cells, but what causes the skin cells to be damaged after being in contact with slowly moving molecules? Does the water in cells and blood freeze? If so what happens to the frozen cell when thawing?",askscience,o6ysqw
