title,body,subreddit,post_id
"If rabies is deadly, how come it didn't eradicate itself?",And any other deases that kills the host fast?,askscience,1dv5kgd
What is Zirconium Ceramic?,"I really wasn't sure if this should be in earth science or chemistry, but I figured chemistry gets it to the state that it is used in medically and industrially.  I'll try to be brief because my head hurts now.

Short version, I'm working on a story in a midevil-esque time period and metals are rare and precious in my world.  So with that in mind, I don't want staple weapons that anyone is able to get ahold of to be metal because most metal only the higher class can afford.  From watching too much TV and movies, I know that ceramic blades exist, mostly in the context of people using them to get a weapon past metal detectors.  But ceramics is a large industry in my world, so I decided to look into it, which led me down a rabbit hole of Zirconium Ceramic products, which is all well and good but I'm trying to find out what it *is* and all I'm getting is technical industry jargon that I can't understand.

From what I understand, ceramic=clay.  But Zirconium is metal.  So metal=/=ceramic.  But there is Zirconium Ceramic???

I just need a simple, clear cut, straight forward answer.  Is this Zirconium mixed *into* clay??  Like a powdered form of it is broken down and mixed into clay which is then processed and molded into products?  That's the only explanation I can think of.",askscience,1e5pati
Is the Delta variant a result of COVID evolving against the vaccine or would we still have the Delta variant if we never created the vaccine?,,askscience,ozh9mi
"ELI5: Why is the human eye colour generally Brown, Blue and other similar variations. Why no bright green, purple, black or orange?",,explainlikeimfive,enttzu
"ELI5: Why are drone strikes on moving targets so accurate, how does the targeting technology work?","Edit: Damn, I did not expect so many responses. Thank you, I've learned a fair amount about drone strikes in the last few hours.",explainlikeimfive,el3nmt
"When someone is dying of hunger or thirst, is there a ""point of no return"" after which they are still alive but if they were given food or water their body would not be able to absorb it fast enough to survive?","And if this point exists, would someone who's past it still be conscious/aware?",askscience,ch9pwm
AskScience AMA Series: We have discovered an Earth-mass exoplanet around the nearest star to our Solar System. AMA!,"*Guests:* Pale Red Dot team, Julien Morin (Laboratoire Univers et Particules de Montpellier, Universite de Montpellier, CNRS, France), James Jenkins (Departamento de Astronomia, Universidad de Chile, Santiago, Chile), Yiannis Tsapras (Zentrum fur Astronomie der Universitat Heidelberg (ZAH), Heidelberg, Germany).

*Summary:* We are a team of astronomers running a campaign called the Pale Red Dot. We have found definitive evidence of a planet in orbit around the closest star to Earth, besides the Sun. The star is called Proxima Centauri and lies just over 4 light-years from us. The planet we've discovered is now called Proxima b and this makes it the closest exoplanet to us and therefore the main target should we ever develop the necessary technologies to travel to a planet outside the Solar System. 

Our results have just been published today in Nature, but our observing campaign lasted from mid January to April 2016. We have kept a blog about the entire process here: [www.palereddot.org](http://www.palereddot.org/) and have also communicated via Twitter @Pale_Red_Dot and Facebook [https://www.facebook.com/palereddot/](https://www.facebook.com/palereddot/)

We will be available starting 22:00 CEST (16 ET, 20 UT). Ask Us Anything!

[Science Release](https://www.eso.org/public/news/eso1629/)",askscience,4zdkra
"ELI5: When a person receives a limb donation, how do surgeons ""wire up"" the nerves so that the recipient can use the limb and feel sensation from it?",,explainlikeimfive,lqb198
"ELI5: If games can render near photo-realistic graphics in real-time, why does 3D animation software (e.g Blender) take hours or even days to render simple animations?",,explainlikeimfive,90tw5o
"ELI5: if fruit is sweet to encourage animals to eat it and carry the seeds away from the parent tree, how do lemons and limes fit into this mix?",,explainlikeimfive,86u0qv
"Is there an altitude on Venus where both temperature and air pressure are habitable for humans, and you could stand in open air with just an oxygen mask?","I keep hearing this suggestion, but it seems unlikely given the insane surface temp, sulfuric acid rain, etc. ",askscience,9z4a37
ELI5: what propels light? why is light always moving?,"i’m in a physics rabbit hole, doing too many problems and now i’m wondering, how is light moving? why?

edit: thanks for all the replies! this stuff is fascinating to learn and think about",explainlikeimfive,l0q82z
"ELI5: How can a psychological factor like stress cause so many physical problems like heart diseases, high blood pressure, stomach pain and so on?",Generally curious..,explainlikeimfive,hbaryf
Eli5: Why do bananas remain sweet and get creamy when they freeze while other fruits seize up into flavorless ice orbs?,"I’m guessing it has to do with water content, but what about the banana makes it creamy? And how does it maintain flavor so much better than other fruits?",explainlikeimfive,hduy8j
Rising land levels in caves?,"I was watching the latest Netflix documentary on Neanderthals and in one cave, buried remains were excavated at a depth of 45 meters. I have a general understanding of geology/geography and know that remains can be buried by water + mud, sand + wind, volcanic ash, etc. But in an enclosed area, where does all this extra material come from? ",askscience,1d66xwe
Eli5: how does polymer clay get softer when kneaded by warm hands but harden when baked?,,explainlikeimfive,1j9ase7
How does fentanyl kill?,"What I am wondering is what is the mechanism of fentanyl or carfentanil killing someone, how it is so concentrated, why it is attractive as a recreational drug and is there anything more deadly?",askscience,1dxqju6
ELI5: How do you move your limbs in such a controlled manner?,"Bear with me. I know how the nerves work, it's a mixture of chemicals and electrical signals. They activate particular muscle groups, and they contract, granting motion.

But how are muscles controlled so carefully and with such a variety of modes? You can swing a hammer or play a piano.

What lets you choose between slow and fast, and hard or soft?",explainlikeimfive,1j6c674
"I've heard that one of the purposes of the ""fresh cut grass"" smell is a type of distress signal that warns nearby plants to start moving nutrients to the roots before they get cut down. Is there any truth to this?","Also, since I mow in the same pattern every week, is the grass at the end of the mowing healthier since it has had more time to ""react"" to the warning? Like, if I always start mowing at the south end of the yard, is the grass at the north end healthier?",askscience,3gsfzg
"Eli5: Why do we need to sleep so much, what happens in the body when asleep that cannot happen while normal resting or relaxing? Or is it just for the brain?",,explainlikeimfive,kbkbsl
Why can't I weigh the earth by putting a scale upside-down?,"PLEASE READ THIS BEFORE ANSWERING

This is a theoretical question about gravity not just a stupid question to be funny. Gravity pulls two objects with mass together. The force of gravity is equal to a mass of the object multiplied by an acceleration of a body (in this case, the acceleration of gravity). Both earth and the scale experience the same gravity acceleration because they are both on earth. The force of the scale on the earth should be it's mass multiplied by the acceleration. Conversely, the force the earth exerts on the scale should be it's mass multiplied by gravity acceleration. 

But Newtons second law states there are equal and opposite forces so the force the scale exerts on the earth should be equal to the force exerted by the earth on the scale. It seems that this case is true because the scale doesn't rocket off into space when you turn it upside down but stays in place. 

So is force really mass x acceleration? Where is this discontinuity coming from? 

EDIT: I hate edit chains so I will keep this short. Thanks for all the answers guys!

EDIT 2: Well this blew up

EDIT 3: Wow front page thanks guys!

EDIT 4: RIP inbox hahhaha

EDIT 5: Thank you so much for replying I read **all** the answers and every post in this thread

EDIT 6: Wow its my top post of all time thanks guys!

EDIT 7: Alright this has been great but I have to go now

EDIT 8: Ok I'm back again

EDIT 9: Brb going to the bathroom

EDIT 10: Back again

EDIT 11: My cat just sneezed

EDIT 12: I'm going to bed now, good night guys!

EDIT 13: I'm up again, couldn't sleep

EDIT 14: Ok now I am really going to bed",askscience,3o82rc
ELI5: how do mirrors reflect objects if they're not facing the mirror directly?,"english is not my first language so I don't know if I made myself clear but imagine something like this: I put a glass of water in front of a mirror and then hold a blanket between the mirror and the glass of water in a way that I can't see it if I look into the mirror directly. still, if I ""peek behind the blanket"" (?), I can still see the glass of water being reflected in the mirror even with the blanket being there. how is that possible?",explainlikeimfive,1j91r7q
ELI5: How do French words like “cul-de-sac” and “hors d'oeuvres“ end up part of the English language without being translated to English words?,,explainlikeimfive,10g65h1
ELI5: Why does the moon look huge in the distance when poping over a mountain but small on a picture or a video?,,explainlikeimfive,bi3fm0
ELI5: What is the role of parasitic worms in nature?,"I mean, most living things are part of the food chain,, they feed different species of animals or they keep other animals under control. 
But when it comes to species such as tape worms and the likes, what is their purpose? Do they even have any predators? How does their population stay under control in nature since animals don't have any means of killing them off? ",explainlikeimfive,1j7dijm
When and how did scientists figure out there is no land under the ice of the North Pole?,"I was oddly unable to find the answer to this question. At some point sailors and scientists must have figured out there was no northern continent under the ice cap, but how did they do so? Sonar and radar are recent inventions, and because of the obviousness with which it is mentioned there is only water under the North Pole's ice, I'm guessing it means this has been common knowledge for centuries.",askscience,ae6h5h
"ELI5: Why does a laptop say it's at 6-8% charge, and then it dies, but when it's at a higher charge, going from 60% to 59% takes a while?",,explainlikeimfive,dv20hs
"ELI5: What is the ""sharp"" in sharp cheddar? How are there various levels of ""sharp""?",,explainlikeimfive,csb1ce
Oat Milk bad for Reproductive Organs?,"Barista here! 
Just had a customer order a Pumpkin Spice Latte and when I said Oat milk was our nondairy option, he backed away and said “whether you know it or not, oat milk messes with your reproductive organs.” 
I then spelled O-A-T to confirm and said, “well I drink it all day so that’s great” 
He confirmed oat and walked away.  
Apologies in advance if this isn’t considered a science question.. I just drink a lot of oat milk and have never heard this/would like to know if there’s any grounds for this claim.",askscience,seybvk
"If humans have evolved to have hair on their head, then why do we get bald? And why does this occur mostly to men, and don't we lose the rest of our hair over time, such as our eyebrows?",,askscience,6qmjd3
ELI5: What causes an Existential Crisis to trigger in our brain?,,explainlikeimfive,5xepq4
How do humans receive Vitamin D from direct exposure to sunlight?,It can also be taken in the form of a pill but I do not understand how something that can be absorbed via light can also be absorbed in physical form. ,askscience,1ezp39d
ELI5: What do the people who go in person to the New York stock exchange actually do? Especially with online trading and information everywhere?,,explainlikeimfive,famrmz
ELI5: In the double-slit experiment why don't the edges of the slits cause the wave to collapse?,"Doesn't the wave have to interact with the slits in order to split into 2 waves to create the interference pattern? How else does it ""know"" to split into 2 waves?",explainlikeimfive,1j5s1v9
How does wood become petrified?,Just curious how some wood can become stone while most just decomposes.,askscience,1etxx2w
ELI5: Why do we feel nostalgia so strongly for things we didn’t even like as kids?,"Okay, so when I was little, I hated waking up early for school. I dreaded those cold mornings, the sound of my alarm, and rushing out the door half-asleep. But now, when I hear an old school bell sound or smell a certain kind of breakfast, I get this weird nostalgic feeling like I miss it.

Why does our brain do this? Why do we romanticize things we used to dislike? Is it just time making everything seem better, or is there some science behind it?",explainlikeimfive,1j4pagx
ELI5: What does the TPP (Trans-Pacific Partnership) mean for me and what does it do?,"   In light of the recent news about the TPP - namely that it is close to passing - we have been getting a lot of posts on this topic. Feel free to discuss anything to do with the TPP agreement in this post. Take a quick look in some of these older posts on the subject first though. While some time has passed, they may still have the current explanations you seek!


* [ELI5: What are the implications of the recently leaked draft of the TPP intellectual property rights chapter? ](http://www.reddit.com/r/explainlikeimfive/comments/1qj9en/eli5_what_are_the_implications_of_the_recently/)
* [ELI5: What is the Trans Pacific Partnership (TPP), what are it's pros and cons? How will it affect us?](http://www.reddit.com/r/explainlikeimfive/comments/23ubdy/eli5_what_is_the_trans_pacific_partnership_tpp/)",explainlikeimfive,3az0fa
ELI5: Why do blacksmiths need to 'hammer' blades into their shape? Why can't they just pour the molten metal into a cast and have it cool and solidify into a blade-shaped piece of metal?,,explainlikeimfive,hmhi4j
ELI5: Why does multiplying two negatives give you a positive?,"Thank you guys, I kind of understand it now. Also, thanks to everyone for your replies. I cant read them all but I appreciate it. 

Oh yeah and fuck anyone calling me stupid.",explainlikeimfive,3r90cw
How are Ozempic and Wegovy the same drug (semaglutide) but treat two different things?,"Is it just marketing or semantics?  They are both administered weekly with similar doses yet insurance companies will die on the hill that you can't have ozempic if you're not type 2 diabetic. Is there something else in the drug that makes it work different? Or is it just ozempic has bigger doses? 
If there isn't a functional difference besides dose size it's like saying you can only take Advil if you have migraine but can take ibuprofen for anything else.
",askscience,1dm7ly4
How do scientists know mitochondria was originally a separate organism from humans?,If it happened with mitochondria could it have happened with other parts of our cellular anatomy?,askscience,11u91h3
ELI5: The calculation which dictates the universe is 73% dark energy 23% dark matter 4% ordinary matter.,,explainlikeimfive,5zore3
Why do hot water and cold water sound different when you slosh them around?,,askscience,1d1q74u
"ELI5: How do we know what names mean? E.g. Hercules wife was called deinara, which means husband destroyer. In ancient greece was this woman literally called husband-destroyer?",,explainlikeimfive,a3b65p
What is the Infection Fatality Rate from COVID 19 if you are fully vaccinated?,,askscience,pjk4ez
"ELI5: How did old forts actually ""protect"" a strategic area? Couldn't the enemy just go around them or stay out of range?","I've visited quite a few colonial era and revolution era forts in my life.  They're always surprisingly small and would have only housed a small group of men.  The largest one I've seen would have housed a couple hundred.  I was told that some blockhouses close to where I live were used to protect a small settlement from native american raids.  How can small little forts or blockhouses protect from raids or stop armies from passing through?  Surely the indians could have gone around this big house.  How could an army come up to a fort and not just go around it if there's only 100 men inside?  

**tl;dr** - I understand the purpose of a fort and it's location, but I don't understand how it does what it does.",explainlikeimfive,dvs33x
Is it possible to put my bare foot on the moon?,,askscience,74vncq
"ELI5: Why is our brain programmed to like sugar, salt and fat if it's bad for our health?",,explainlikeimfive,5xve3i
"Vertebrates have haemoglobin in the blood and myoglobin in muscles. What do invertebrates which use haemocyanin/etc. in place of haemoglobin, use in place of myoglobin?","Before anyone says so in the comments, yes I am aware that the phrasing (probably erroneously) implies that haemoglobin+myoglobin is the default & conservative phenotype, and the others are innovative replacements, but I was trying to be as concise as possible for the sake of readability.",askscience,1eu26uj
"If a 20 year old gets an organ transplant from a 50 year old, 30 years later is that organ functioning as if it were 80 years old or 50 years old?",,askscience,akzk33
Why is the Congo River so deep?,"I just read that the Congo River is, like, 220m deep. The Nile apparently is only about 8 to 11 m deep on average. And it is double the Amazon's 100m. 

I mean 220m is basically the depth of Lake Huron. Motherfucker is *DEEP*.

But ... why?",askscience,7j0adq
[ELI5] What's the benefit of calculating Pi to now 62.8 trillion digits?,,explainlikeimfive,p5ynq0
Why do we use pillows now when we sleep? Did we need this during the prehistoric/ancient age? What changed?,,askscience,85kaz5
Is there a physics based limit to how large a planet can be?,"UY Scuti is a red supergiant star with a radius of 1.188 billion kilometers or 1,708 times larger than the sun. It  doesn't seem reasonable to think that their could possibly be a telluric planet 1708 times larger then earth. And of course, there is not as much data on exoplanets as of yet to have some hard evidence yet of some potential planet sizes.

Is there any physics based science that would show that there are upper limits for either rocky or gas planets?",askscience,1eqwfse
"ELI5: What do they mean when they say Jupiter is a ""gas"" planet? Could a rocket be shot through it? Could an astronaut (or spacecraft) ""land"" on it?",,explainlikeimfive,4th2bb
ELI5: Why does plastic turn white when you bend it?,,explainlikeimfive,aek510
"ELI5: If I enter a password wrong thrice, the system locks me out. How are hackers able to attempt millions of combinations of passwords without the system locking them out?","Edit: Thank you everyone who’s taken out time to explain it to me. I’ve learnt so much. Appreciate it. 

Yes, I do use ‘thrice’ in my conversation whenever required. I’m glad it amused so many of you.",explainlikeimfive,h98tzm
Does lightning strike more often at higher elevations?,There's a storm right now and lightning struck close enough I felt it and that seems to happen a lot more here than it did in Nebraska...,askscience,1f599ob
"ELI5: Why were ridiculously fast planes like the SR-71 built, and why hasn't it speed record been broken for 50 years?",,explainlikeimfive,ircby5
When would the atomic number not equal the proton number?,"I had assumed they were interchangeable terms, but on wikipedia I just read: 

‘The atomic number or nuclear charge number (symbol Z) of a chemical element is the charge number of an atomic nucleus. **For ordinary nuclei composed of protons and neutrons**, this is equal to the proton number (np) or the number of protons found in the nucleus of every atom of that element.’

What kind of unordinary nucleus would make these different? Is there something else in the nucleus included in the atomic but not the proton number?",askscience,1ene6es
AskScience Panel of Scientists XXVI,"**Please read this entire post carefully and format your application appropriately.**

This post is for new panelist recruitment! The previous one is [here](https://www.reddit.com/r/askscience/comments/198hzvn/askscience_panel_of_scientists_xxv/).

The panel is an informal group of Redditors who are **either professional scientists or those in training to become so**. All panelists have at least a graduate-level familiarity within their declared field of expertise and answer questions from related areas of study. A panelist's expertise is summarized in a color-coded AskScience flair.

Membership in the panel comes with access to a panelist subreddit. It is a place for panelists to interact with each other, voice concerns to the moderators, and where the moderators make announcements to the whole panel. It's a good place to network with people who share your interests!

\-------------------

**You are eligible to join the panel if you:**

* Are studying for at least an MSc. or equivalent degree in the sciences, AND,
* Are able to communicate your knowledge of your field at a level accessible to various audiences.

\-------------------

**Instructions for formatting your panelist application:**

* Choose exactly one general field from the side-bar (Physics, Engineering, Social Sciences, etc.).
* State your specific field in one word or phrase (Neuropathology, Quantum Chemistry, etc.)
* Succinctly describe your particular area of research in a few words (carbon nanotube dielectric properties, myelin sheath degradation in Parkinsons patients, etc.)
* Give us a brief synopsis of your education: are you a research scientist for three decades, or a first-year Ph.D. student?
* Provide links to comments you've made in AskScience which you feel are indicative of your scholarship.  Applications will not be approved without several comments made in /r/AskScience itself.

\-------------------

Ideally, these comments should clearly indicate your fluency in the fundamentals of your discipline as well as your expertise. We favor comments that contain citations so we can assess its correctness without specific domain knowledge.

Here's an example application:

`Username: /u/foretopsail`

`General field: Anthropology`

`Specific field: Maritime Archaeology`

`Particular areas of research include historical archaeology, archaeometry, and ship construction.`

`Education: MA in archaeology, researcher for several years.`

`Comments: 1, 2, 3, 4.`

Please do not give us personally identifiable information and please follow the template. We're not going to do real-life background checks - we're just asking for reddit's best behavior. However, several moderators are tasked with monitoring panelist activity, and your credentials will be checked against the academic content of your posts on a continuing basis.

You can submit your application by replying to this post.",askscience,1e73crx
"If bruises are from bleeding underneath the skin, where does all the blood go when it heals?",,askscience,fkhtzw
Does antihydrogen have the same orbital size/shape as hydrogen?,"(not sure if Physics may be a more appropriate flair - I apologize if I mis-flaired this post)

Would anti-hydrogen i.e. the antimatter counterpart of Hydrogen, have the same orbital levels and shapes, as regular hydrogen? Would a more complex structure like anti-oxygen (we haven't synthesized this yet as far as I know - so theoretically) have the same shape/size orbitals as 'normal' Oxygen?

While thinking about this I was also wondering if anti-hydrogen, would be considered an element? (as a side question, would we need to redo the periodic table to accommodate these antimatter elements?)



Thank you.",askscience,1f2lcxc
ELI5 Why do people seem to age so incredibly fast after a traumatic experience?,For example a woman I know seemed to have aged at least ten years in a very short time after her grandchild died in an accident.,explainlikeimfive,jth16v
ELI5: What exactly a Data Analysist do?,"I heard a lot about Data Analysis as a career choice, but I have never fully understand what exactly do they do within a company. What data do they analyze, are they in charge of gathering it? I have so much questions!",explainlikeimfive,1j7l8nm
Are all birds decended from one species that evolved to the variety we see today or did multiple species of birds survive the dinosaur extinction?,"finches, ostrich, robins, parrots, eagles, penquins, and so many more. Some have curved beaks others have pointy. Do our modern birds share a common ancestor that survived the extinction then diverged and evolved or is the variety of birds do to them already on divergent paths and each survived? If so do we have any idea how many surviving branches there are?",askscience,1exd4mb
ELI5: Why did it take 1 year to construct the Empire State Building in 1930 but 7 years to construct One World Trade Center in modern times?,Shouldn't modern technology speed up the construction process?,explainlikeimfive,4lhzxi
ELI5: why do the fastest bicycles have really thin tyres but the fastest cars have very wide tyres,,explainlikeimfive,lucq3s
"Eli5: Derivatives. The U.S.A has 687 trillion dollars of ""currency and credit derivatives."" What exactly does this mean?",,explainlikeimfive,hp9dqv
ELI5: Why do we retain memories if all of our cells replace themselves after a small amount of years?,,explainlikeimfive,lixl1w
