title,body,subreddit,post_id
can a cell survive a viral infection in humans,if a cell is infected with a virus  begins expressing nonself viral genesproducing viral proteins is it possibleare there instances where the cell can clear out the virus internally andor survive an immune response with the virus being cleared from the cell,askscience,1d79ujv
why is australia so overwhelmingly dry when nearby places like papua new guinea new zealand indonesia and tasmania are all so wet and lush,,explainlikeimfive,eioz15
are there any places in the world that would normally be cold but are warmer due to geothermal effects like hot springs but the whole area is warmer,ive got an idea for a base in minecraft a warm oasis in a frozen tundra that is heated by lava pools  similar effects where people have built farms and houses and stuff i know hot springs exist but those only warm small areas around the pools are there any places in the world where larger areas are warmed by the ground itself,askscience,1djudzs
does a burnt piece of toast have the same number of calories as a regular piece of toast,,askscience,7jpnjl
why does touching tinfoil with your teeth especially when you have fillings hurt so much,,explainlikeimfive,ip7d4o
if dividing by zero is undefined and causes so much trouble why not define the result as a constant and build the theory around it like i was defined to be the sqrt of 1 and the complex numbers,,askscience,8l8faa
if you put a giant mirror on the floor of the earth and make a photo from a satelite what would you be able to see,in my class this came up in a discussion and we were unsure what the result would be 1 the mirror would be blue as it reflects the color from the sky 2 the mirror would be black as it reflects the color from outer space 3 the mirror would be white as the rayleigh scattering from the atmosohere gets canceled x200b edit 1 thanks for your answers my conclusion of this would be that the image of the mirror would be blue if there is no sun in the frame edit 2 changed refraction to rayleigh scattering x200b,askscience,ayo4xr
why can people walk many miles without discomfort but when they stand for more than 15 minutes or so they get uncomfortable,,explainlikeimfive,6joszt
i use a p100 respirator to protect myself from infection but sometimes powerfully malodorant smells garbage full of diapers etc are noticeable through the mask does this indicate that i am at risk of infection from airborne sources specifically corona virus,,askscience,ie0lpu
mohs hardness scale is it ever possible to scratch something harder with something softer,hi as per title do below points factor into the ability of the object to scratch another object i could never get a straight answer 1 does the force applied matter 2 does sharpness edge point of the object matter,askscience,1e3vbwt
how does nasa and other space agencies protect their spacecraft from being hacked and taken over by signals broadcast from hostile third parties,,askscience,rpohd9
if nicotine flushes out of your body within a week why do ex smokers have physical cravings even long time after quitting,,explainlikeimfive,qz1yz6
why faster than light travels create time paradox,i mean if something travelled faster than light to a point doesnt it just mean that we just can see it at multiple place but the real item is still just at one place  why is it a paradox only sight is affected i dont know like if we teleported somewhere its faster than light so an observer that is very far can see us maybe at two places but the objet teleported is still really at one place like every object,explainlikeimfive,1j9hk69
i remember during the 90s00s that the ozone layer decaying was a consistent headline in the news is this still happening,,askscience,4q3msq
can sparkling water be found in nature,,askscience,1evat15
why does macaroni and cheese lose so much flavor when refrigerated then reheated,,explainlikeimfive,ckaww5
how small is a genetic bottleneck and how did humans get out of it,i understand the principle the population is so small that you cant reproduce with anyone without it being inbreeding and i know due to ecological and geological factors thousands of years ago humans were going through a bottleneck so how did we get out of it unscathed was it neanderthals contributing to genetic diversity and for that matter how small does a population have to be to be a bottleneck a thousand surely but ten thousand hundred thousand,explainlikeimfive,1j5rl8b
what happens to mimic species when their mimic goes extinct,for example monarch butterflies and viceroy butterflies monarchs are the toxic ones animals know not to eat but viceroys are not i think if the monarchs go extinct as theyre threatened to how long before the viceroys mimicry is no longer effective,askscience,1doymj6
why do some women die when giving birth what is modern medicine doing to prevent that,,explainlikeimfive,12zhii5
how deep does a sun tan penetrate into skin,,askscience,1dkh0wg
is there any reason for the alphabet being in the order its in,,askscience,7xmrjn
how do you know a datedat 1 million year old hammer wasnt 09999 million year old rock that was just made into a hammer in the last 00001 years,,askscience,2qfvcf
how does anesthesia work,,explainlikeimfive,1jblqn9
explain the new moon phase please,in phases of the moon diagrams the new moon phase is shown to have the moon inbetween the earth and the sun if the sun is in the same direction as the moon then it wouldnt be night and would be day does this mean that the new moon phase just means no moon and not yes moon but not visible if not please explain maybe im just really dumb,explainlikeimfive,1ja8xx7
cpus have billions of transistors in them can a single transistor fail and kill the cpu or does one dead transistor not affect the cpu,cpus ang gpus have billions of transistors can a dead transistor kill the cpu edit spelling also thanks for the platinum d,askscience,bew9ft
why can some people only sleep on their back and others only on their front or side,,explainlikeimfive,6hfgph
why is there no cure for herpes what is the problem that cant be solved,,explainlikeimfive,tfckc9
why do canker sores appear taste like metal and feel weird when your tongue touches them,,explainlikeimfive,ednlbv
why do cats follow us to the bathroom,why do cats follow us into the bathroom why do cats join us in the bathroom no matter if im peeing bathing or showering kevin has to join me even if hes dead asleep and hears the shower being turned on he will bolt to the bathroom currently lying in the bath with my sleeping cat next to me,explainlikeimfive,1j4c56n
went on vacation fridge died while i was gone came back to a freezer full of maggots how do maggots get into a place like a freezer thats sealed air tight,,explainlikeimfive,6i881n
why do serrated bread knives stay sharp for ever but my relatively good kitchen knives need a lot of attention esp to slice tomatoes,eli,explainlikeimfive,qj1ehw
how is genetic diversity gained in small population,we all know a small population can lead to bad results like inbreeding but what about animals that had their populations lowered to a great degree either through diseases hunting or any other  for example cheetahs how do they gain more genetic diversity would it slowly build up through time or is the population doomed to a slow death,askscience,1d77jn4
why does everyone say to drink lots of fluid when you have a cold,i have a cold and everyone says drink lots of fluid what does this actually do if i drink lots of fluid as opposed to not drinking fluid while having a cold,explainlikeimfive,74owxj
why can you sign up for an email list instantly but to unsubscribe it can take up to 10 days is there an actual technical reason or is it a sales tactic to try to make you reconsider,,explainlikeimfive,135lvzw
why is it so difficult to type ie move your fingers quickly and precisely or even at all when your hands are very cold,,explainlikeimfive,7dvd9n
would a clone of a brindle dog have the same coat pattern,its my understanding that in something like a calico cat the x inactivation is random and therefore a calico cat clone would have a different pattern thats not at all how brindle coats work in dogs since you know brindle males are common so im curious,askscience,1dms9cw
india is now experiencing double and triple mutant covid19 what are they will our vaccines astrazeneca pfizer work against them,,askscience,mvjapr
why does pepsi in a can taste different from pepsi in a glass or plastic,,explainlikeimfive,n7xojf
how do we know what dinosaurs ate exactly if only their bones were fossilized,without their internal organs like the stomach preserved or fossilized how do we know edit thank you all for your very informative answers,askscience,8l2p6j
was there a scientific reason behind the decision to take a picture of this particular black hole instead of another one,i wondered why did they elected this one instead of a closer one for instance thank you,askscience,bbwc8o
why do jet engines and rockets focus the exhaust,my question is that if its a mass problem where the massspeed of the combusted fuel is what is causing the thrust why are jets and rockets designed with a choke near the exhaust to increase the speed reduce the mass of the exhaust wouldnt the energy still be the same regardless of the speed since there is a decrease in mass being ejected how is a geometry change adding any energy is it just to increase overall combustion,askscience,1f9sjlu
how do video game recompilations work to get a game natively running on pc,with the recent recomp of sonic unleashed granting an unofficial pc port im interested in to how exactly that works,explainlikeimfive,1j6mo9p
how does an image processing algorithm work,like how an algorithm like yolo enables the computer to be able to see stuff,explainlikeimfive,1j6dasq
how can people sever entire legs and survive the blood loss while other people bleed out from severing just one artery in their leg,,askscience,7qhoz3
how does calculator know and use pi if even super computers cant know all the digits does it use like first 100 digits,,explainlikeimfive,ndmek0
if a black holes singularity is infinitely dense how can a black hole grow in size leagues bigger than its singularity,doesnt the additional mass go to the singularity its infinitely dense to begin with so why the growth,askscience,dswjlc
where do those extra four minutes go every day,the earth fully rotates in 23 hours and 56 minutes where do those extra four minutes go i know the answer is supposedly leap day but i still dont understand it from a daily time perspective i have to be up early for my job which right now sucks because its dark out that early so every day ive been checking my weather app to see when the sun is going to rise and every day its a minute or two earlier because were coming out of winter but how the heck does that work if theres a missing four minutes every night shouldnt the sun be rising even earlier or later and how does it not add up to the point where noon is nighttime it hurts my head so much please help me understand,explainlikeimfive,lkfesf
why is that if you fall asleep hungry you still wake up feeling more or less fine,,explainlikeimfive,c71z22
how could germany in a span of 80 years 19182000s lose a world war get back in shape enough to start another one in 20 years only lose it again and then become one of the wealthiest country,my goddamned country in 20 years hasnt even been able to resolve minor domestic issues whats their magic edit thanks to everybody for their great contributions be sure to check for buried ones cause theres a lot of good stuff down there also udidijustdidthathttpwwwredditcomuserdidijustdidthat is totally not crazy i mean it,explainlikeimfive,2mp3qh
what is a hedgefund,ive been trying to follow the wall street bets situations but i cant find a simple definition of hedge funds help,explainlikeimfive,l6ptb7
do tanks actually have explosives attached to the outside of their armour wouldnt this help in damaging the tanks rather than saving them,,explainlikeimfive,t3h7i0
someone please explain standard deviation to me,first of all an example mean age of the children in a test is 1293 with a standard deviation of 76 now maybe i am just over thinking this but everything i google gives me this big convoluted explanation of what standard deviation is without addressing the kiddy pool im standing in edit you guys have been fantastic this has all helped tremendously if i could hug you all i would,explainlikeimfive,mexgnw
why do we use co2 for sparkling drinks rather than any other gas,just curious,askscience,i2z50x
what is the reason that almost every video game today has removed the ability for split screen including ones that got famous and popular from having split screen,,explainlikeimfive,6o4cgc
why and how does alcohol withdrawal cause seizures,saw a video of someone going through alcohol withdrawal shaking violently,explainlikeimfive,1j46whd
are there viruses that infect reproduce and spread without causing any ill effects in their hosts,,askscience,fs0drs
how is that alcohol 70 is better than alcohol 90 as disinfectant,,explainlikeimfive,erfec8
im wondering as to why all the birds insects and fish were very large back in the mesozoic age compared to what they are now,why are they much smaller today,askscience,b6v02u
what does it feel like walking in areas with high radiation does it feel hot or something does it smell harder to breathe or is the only way you will figure it out wout a geiger meter is when you start to get sick,edit sorry for the wrong flair not a science guy so i just kind of associated the elements involved with chemistry,askscience,6cgdnn
could emc2 just be em if we used larger units for m,emc2 describes the ratio between energy and mass using our current units of energy and mass in a hypothetical alien culture where units for mass happened to be c2 times larger would they simply arrive at em or is the square of the speed of light fundamentally relevant here thanks,askscience,1e5x7ba
why are there so many different types of golf clubs in golf,when it comes to golf i know there are things like a nine iron a putter a sandwidge but while i know there are many different types of golf clubs but can someone please eli5 why there are so many different kinds and types of golf clubs,explainlikeimfive,1j7b0k9
howwhy is space between the sun and the earth so cold when we can feel heat coming from the sun,,explainlikeimfive,pjtcug
when will the earth run out of oil,,askscience,dur4qo
how do keratinocytes contribute to the innate immune system,hi all just wondering whether someone could help me out  id like to know how keratinocytes contribute to the innate immune system i have tried google but couldnt get a straight answer any information would be greatly appreciated tia mads,askscience,1dj2b5u
why do nostril pimples hurt so much more than regular pimples,,explainlikeimfive,8ebmwb
what is gaslighting and some examples,i hear the term gaslighting used often but i cant get my head around it,explainlikeimfive,a5p2ca
why does your neck get tense when youre stressed and how does a massage fix it,,explainlikeimfive,9o64w8
when octopussquidcuttlefish are out of the water in some videos are they in pain from the air or does their skin keep them safe for a prolonged time is it closer to amphibian skin than fish skin,,askscience,7w632y
why cant we talk in our normal voice while crying,what contributes to the trembling and chocked up sound of our voices when we cry,explainlikeimfive,jcgcu3
how do we know dinosaurs were reptiles,their only living relatives are birds and their are already theories that they could have had feathers or looked completely different do their bones really tell us that much do we actually know they were reptilian or is it just a theory,askscience,1d8fkhf
is gravity weaker on the equator just because the radius is larger or also because of a centrifugal force,and if a centrifugal force also has an effect how large is it compared to the difference in radii,askscience,6f3qee
what would happen to me and everything around me if a black hole the size of a coin instantly appeared,,askscience,39woqa
why is it so hard to make other cpu cores be used,i play a lot of games and one common issue is that some games only use 13 out of 10 cores the pc has why cant the code be spread along all cores automatically instead of having it be built in the code what is the point of having 10 cores if anything hardly ever uses all 10 cores simultaneously,explainlikeimfive,1j6byqx
why is it more difficult to inhale when a force of wind or cold air is hitting your face,,explainlikeimfive,6qpi4t
why is armpit sweat much more pungent than sweat from other areas of the body such as back sweat,,explainlikeimfive,jkyl3h
what happens to water when it freezes and cant expand,,askscience,6jkg7l
askscience ama series we have made the first successful test of einsteins general relativity near a supermassive black hole aua,we are an international team led by the max planck institute for extraterrestrial physics mpe in garching germany in conjunction with collaborators around the world at the paris observatorypsl the universite grenoble alpes cnrs the max planck institute for astronomy the university of cologne the portuguese centra  centro de astrosica e gravitacao and eso our observations are the culmination of a 26year series of evermoreprecise observations of the centre of the milky way using eso instruments the observations have for the first time revealed the effects predicted by einsteins general relativity on the motion of a star passing through the extreme gravitational field near the supermassive black hole in the centre of the milky way you can read more details about the discovery here eso science releasehttpswwwesoorgpublicnewseso1825 several of the astronomers on the team will be available starting 1830 cest 1230 et 1730 ut we will use the eso account to answer your questions ask us anything eso facilitates this session but the answers provided during this session are the responsibility of the scientists,askscience,921mov
the video game subnautica depicts an alien planet with many exotic underwater ecosystems one of these is a lava zone where molten lava stays in liquid form under the sea is this possible,the depth of the lava zone is roughly 12001500 meters and the gravity seems similar to earths could this happen in real life with or without those conditions,askscience,7vgwdg
why does an orchestra have many people playing the same instruments how does it add to the overall performance,,explainlikeimfive,m8u1er
since light stops penetrating water at 1000 meters deep and the deepest freshwater lake is 1642 meters deepboth according to google is there an equivalent to deep sea creatures for freshwater,i couldnt find anything on google,askscience,7sewfa
if you jump into a volcano filled with flaming hot magma would you splash or splat,,askscience,9tsbem
why arent all black holes the same size,so a black hole is a point of infinite density where the curvature of space time has approached infinity if infinity has only one value which is infinity then why are there black holes of different sizes and masses i understand that larger black holes may have consumed more mass than other black holes but if the spacetime curvature in a black hole always approaches infinity shouldnt they all be the same size,askscience,1ecinpo
has the amount of natural carbon 14 deposition in organisms changed over time,as with the passage of deep time the sun became more active and has a greater irradiance this means that the amount of lightradiation that the earth received also increased over time because of this the atmosphere receives more radiation then the amount of nitrogen that becomes carbon 14 and is deposited in living beings also increased over time taking into account that the carbon 14 deposited in the current and ancient organism has the same age at the time of the animals death in their respective periods,askscience,1edi3m7
how do seeds know which way is up,so i was doing some gardening with my 9yo daughter and we moved on to planting some seeds she was studying them carefully before dropping them into the holes in the compost i asked her why and she said that she was trying to make sure she planted them the right way up otherwise they wouldnt grow upwards and flower as cute as it is this got me thinking how does a seed know which way is the right way to grow,explainlikeimfive,69sb1q
at the heat death of the universe will most black holes eventually merge due to the incredibly long timescale before they evaporate from hawking radiation or will most black holes not merge due to the sheer vastness of space between them,,askscience,afk6xy
given that radiowaves reduce amplitude according to the inverse square law how do we maintain contact with distant spacecraft like voyager 1  2,,askscience,gwzute
why is it appropriate for pg13 moviesshows to display extreme violence such as mass murder shootouts but not appropriate to display any form of sexual affection nudity sex etc,,explainlikeimfive,5uhr0x
how does a video game or software randomly decide something,ive been wondering this for a long time and has never really found an answer to this when a game has a certain percentage chance of getting a critical hit for instance how does it decide wether or not give you one i dont quite understand how a computer can just randomly decide something without having a real conscience its not like in real life where you can flip a coin or something it has to have a certain pattern instead right,askscience,7law0k
why do exothermic reactions not break the laws of thermodynamics,,explainlikeimfive,1j5z2te
when the atmospheric oxygen content increased 35 billion years ago where did that oxygen come from and did it replace another gas or did it just increase the mass of the atmosphere,in the present to my understanding oxygen in the atmosphere is produced by plants which do so using carbon dioxide and that phytoplankton were the primary cause of the massive jump in atmospheric oxygen content that happened during the archean my question is that given that there were basically only single celled organisms on earth where did the oxygen come from in the first place is it bonded in rocks and trapped in the crust and the phytoplankton were able to free it was it dissolved in the ocean was it somehow transported from another part of the galaxy such as in an meteor was there significantly more carbon dioxide in the atmosphere and if there was carbon dioxide where did that come were there mono cellular organisms on earth already undergoing cellular respiration and if so where did they get the oxygen to do so in the first place,askscience,1emy3cc
does oxygen load onto haemoglobin sequentially or simultaneously,conflicting messages in the textbooks on this one i understand that cooperative binding occurs resulting in each sequential o2 bound to the hb tetramer to be easier to add than the previous however both the following seem plausible to me as a consequence of this phenomenon 1 hypothesis 1 the majority of haemoglobin exists fullysaturated oxyhemoglobin or fullydesaturated deoxyhaemoglobin with  saturations being based on a ratio of the two this is because oxygen will preferentially bind to haemoglobin molecules which have already overcome the relatively high energy barrier required to bind the first oxygen molecule 2 hypothesis 2 the  saturation represents a ratio of amount of oxygen carried by the haemoglobin and the amount that could be carried by the haemoglobin ie a population of hb molecules at 75 saturation would all contain a distribution of oxygen molecules centred on a mean of 3 under this hypothesis only the last fourth molecule tends to be loaded at the lungs and unloaded at the tissues so which one is it both seem plausible both are given as explanations in different sources only the former seems to be compatible with my understanding of how a pulse oximeter works,askscience,1d897gf
elif why is restaurant food vastly more calorie dense than preparing food at home even at restaurants where they cook everything fresh the calorie count is insane,,explainlikeimfive,8s84d7
why do antidepressants cause suicidal idealization,just saw a tv commercial for a prescription antidepressant and they warned that one of the side effects was suicidal ideation why more importantly isnt that extremely counterintuitive to what theyre supposed to prevent why was a drug with that kind of risk allowed on the market thanks for the info edit i mean ideation well my spell check says thats not a word but everyone here says otherwise spell check is going to have to deal with it thanks for the correction,explainlikeimfive,66zkaf
since we measure nuclear warhead yields in terms of tonnes of tnt would detonating an equivalent amount of tnt actually produce a similar explosion in terms of size temperature blast wave etc,follow up question how big would a tzar bomba size pile of tnt be 50 megatons,askscience,a2t0wj
why is around 200c 400f the right temperature to cook pretty much everything,,explainlikeimfive,iyhphu
why does the moon appear larger and red during moonrisemoonset,,askscience,1dh8bw9
how do pharmaceutical companies get away with advertising and selling medication with fatal side effects like strokes and death,,explainlikeimfive,1j6mvrk
what caused the carnian pluvial event  and is it true that it rained for 2 milion years,,askscience,1cxae8l
how do zip files compress information and file sizes while still containing all the information,,explainlikeimfive,5kohsr
how do hive applications get startup users apps like tinder meetup and other social apps,,explainlikeimfive,65rjxg
