title,body,subreddit,post_id
askscience ama series happy world breastfeeding week we are human milk and lactation scientists hailing from a range of clinical and scientific disciplines ask us anything,hi reddit we are a group of lactationhuman milkbreastfeeding researchers in honor of world breastfeeding weekhttpswwwwhointcampaignsworldbreastfeedingweek2024 we are here to answer your burning questions about babies boobs and breastmilk lactation science is fraught with social complexity in recent years tensions between researchershttpstheconversationcombreastfeedingresearchimproveslivesandadvanceshealthbutfacesconflicts151820 advocates  industryhttpswwwthelancetcomseriesbreastfeeding2023 have reached a crescendo that impacts both our work and the lived experiences of breastfeeding families we believe that this science belongs to everyone and that engaging the public on this topic is an important part in addressing these challenges science should never make anyone feel bad but instead should inspire awe and curiosity world breastfeeding week is a global event held in the first week of august every year supported by who unicef and many government and civil society partners the theme for 2024 is closing the gap breastfeeding support for all wbw celebrates all breastfeeding journeys no matter what it looks like for you while showcasing the ways families societies communities and health workers can have breastfeeding parents backs in recent years public health experts have been moving from simply promoting breastfeeding toward protecting promoting and supporting breastfeedingthat is emphasizing the role of the entire community in creating the conditions that make breastfeeding easier more accessible and sustainable for all families who want it todays group hails from biochemistry epidemiology microbiology neonatology family medicine nursing epigenetics and biological anthropology we can answer your questions in english portuguese italian farsi sinhalese and hindi we will join from 112pm cst  123pm est 1619 ut ask us anything todays panelists  raha afshariani md ibclc alc uquietsquare2570 is a pediatrician boardcertified lactation consultant advanced lactation consultant academy of lactation policy and practice and is the special project director for the canadian lactation consultant association dr afshariani was a lecturer at shiraz university for 12 years she is a passionate advocate of communitybased breastfeeding promotion she is founder of r and r consulting which guides and educates breastfeeding families with emphasis on both parental roles  meghan azad phdhttpsumanitobacamedicinedepartmentpediatricsandchildhealthfacultystaffmeghanazad umilkscience is a biochemist and epidemiologist who specializes in human milk composition and the infant microbiome dr azad holds a canada research chair in early nutrition and the developmental origins of health and disease she is a professor of pediatrics and child health and director of the thrive discovery labhttpswwwthrivediscoverycathrivelabmembershtml at the university of manitoba she cofounded the manitoba interdisciplinary lactation centre milchttpwwwmilcresearchcom and directs the international milk composition consortium imic check out this short videohttpswwwyoutubecomwatchvnqvgf5vmtau about her research team her recent appearance on the biomes podcasthttpswwwyoutubecomwatchvn0cblqamg2mabchanneldrruairirobertson and her labs youtube channelhttpswwwyoutubecomchannelucpypsooa2i1lxjp7kn4zkw twitterx meghanazadhttpstwittercommeghanazad  emma bhakuni uemmabhakuni is a neonatal clinical support worker with south warwickshire nhs foundation trust in the uk she has 11 years experience working between maternity and neonatal care in different nhs trusts where she has spent a lot of time providing practical breastfeeding support to new families she has experience with both full term and premature neonates she is also a student at the university of cambridge where she is currently studying towards her medical degree  bridget mcgann ubabiesandbones is an anthropologist who studies lactation as a biocultural system and how it shaped us as a species she is a research assistant and science communicator at thrive discovery labhttpswwwthrivediscoverycathrivelabmembershtml she was a founding team member at march for science along with umockdeath she has a ba in anthropology from indiana university and is a masters student in biological anthropology at the university of colorado denver check out her standup act about luke skywalkers green milkhttpsyoutubev4pribejq7ksipi5asu6c9mcodpz2 a thing she wrote about breastfeeding controversieshttpsraisingwonderwordpresscom20190808itstimetotalkaboutthebreastfeedingsciencebacklashmovement and some of her top commentshttpswwwredditcomuserbabiesandbonescommentssorttop twitterx and bluesky bridgetmcgannhttpstwittercombridgetmcgann bridgetmcgannhttpsbskyappprofilebridgetmcgannbskysocial instagram raisingwonderhttpswwwinstagramcomraisingwonder tiktok raisingwonderhttpswwwtiktokcomraisingwonder  karinne cardoso muniz md ukarinnemuniz is a neonatologist and graduate student in pediatrics and child health msc at the university of manitoba dr cardoso muniz worked as a dedicated doctor specializing in neonatology and as a coordinator for the society of pediatrics in brasilia brazil specifically for the neonatal resuscitation program throughout her clinical career she has passionately witnessed and promoted breastfeeding and use of human milk in improving health outcomes of both fullterm and premature infants here is a lecturehttpsyoutubejt21ayibo2esisxc350g2jyabxlcf she gave in portuguese about newborn resuscitation  ryan pace phdhttpshealthusfedunursingresearchresearchersryanpace uryanpace is an assistant professor and assistant director of the biobehavioral lab at the college of nursing and usf health microbiomes institute university of south florida his research revolves around understanding how lactation and the microbiome relate to human health and development dr paces current research investigates diverse aspects of maternalinfant health including relationships among maternal diet human milk composition and maternalinfant microbiomes as well as the role of human milk in modulating immunological risks and benefits to mothers and infants twitterx drryanpacehttpstwittercomdrryanpace linkedinhttpswwwlinkedincominryanpace32628867 google scholarhttpsscholargooglecomcitationsusermyeeziiaaaajhlen  christina raimondi md ccfp fcfp ibclc pmhc nabblmc ufrozenlemonada is a family doctor and a pioneer in breastfeeding and lactation medicine dr raimondi is a founding member of the north american board of breastfeeding and lactation medicine nabblmhttpsnabblmorg which last year launched for the first time a branch of medicine dedicated to lactation yep for the first time she is also a cofounderceo at the winnipeg breastfeeding centrehttpwpgbreastfeedingcentrecom to learn more about dr raimondis work check out this podcast episodehttpswwwyoutubecomwatchvromvecqmtogabchannelwellthymd 30 min and this youtube videohttpswwwyoutubecomwatchappdesktopvescgdjbrofoabchanneldoctorsmanitoba 2 min featuring her and her collaborator katherine kearns instagram mbmilkdocshttpswwwinstagramcommbmilkdocs twitterx christinaraimo6httpstwittercomchristinaraimo6  sanoji wijenayakehttpswwwwijelabcateamdrwijenayake phd uwijenayakelab is a cell and molecular biologist who studies human milk not as a food but as a bioactive regulator of postnatal development and growth dr wijenayake is an assistant professor and principal investigator at the university of winnipeg her research focuses on a notsowell known component of human milk called milk nanovesicles milk nanovesicles are tiny fat bubbles that carry all sorts of important material between parents and their children milk nanovesicles hold great therapeutic potential as drug carriers and provide universal antiinflammatory benefits wwwwijelabcahttpwwwwijelabca linkedinhttpswwwlinkedincominsanojiwijenayakephd59040045 twitterx drsanojihttpstwittercomdrsanoji  edit thank you for your thoughtful questions everybody we learned a lot and had so much fun a few of us commented to each other how thoughtful and informed the questions were when you spend a lot of time with a topic every day its easy to get a bit up in your head about it so this was really helpful for us to take a step back and get a sense of what the wider public is thinking about with regards to our work you gave us a lot to think about and even got us thinking about future research questions to pursue some of us will hang back a bit past our official end time 3pm est and some of us will pop in out throughout the rest of the day and answer any stragglers world breastfeeding week continues through the 7th wed but that wont be the end of what is a more than monthlong party  august 814th indigenous milk medicine weekhttpswwwindigenousmilkmedicinecollectiveorgmilkmedicineweek  august 1521 asian american native hawaiian  pacific islander breastfeeding weekhttpscaliforniabreastfeedingorgaanhpibreastfeedingweek2023  august 2531 black breastfeeding weekhttpsblackbreastfeedingweekorg bbw  september 39 semana de la lactancia latinahttpswwwfacebookcomlatinxbreastfeedingweek,askscience,1ei75mx
why does the flame of a cigarette lighter aid visibility in a dark room but the flame of a blowtorch has no effect,,askscience,c3w9d8
how did scientists know the first astronauts spacesuits would withstand the pressure differences in space and fully protect the astronauts inside,,askscience,b9y8ct
how comes when you buy vitamins separately they all come in these large capsulestablets but when you buy multivitamins they can squeeze every vitamin in a tiny tablet,edit thanks for all the replies didnt expect such a simple question to blow up to all the people being mad for no reason have a day off for once,explainlikeimfive,jvqdzo
what is the pattern to orchestral flute fingerings,hello i have recently acquired an orchestral flute and as i think plain memorization of what fingering equals what letter note is stupid along with sheet music i need to figure out how on earth the buttons on this flute work since they clearly are not incremental or whatever the word is so that i can play by earmimic tunes i feel like im just trying random shit and getting random notes and i need to know how they work so i can see the patterns and figure it out for myself thank you ps i think the answer will probably involve physics of wind or something so thus the tag,explainlikeimfive,1j5gcej
why do dogs have such extreme diversity in size shape and attributes when compared to cats,domestic dogs have an extreme amount of variety when compared to domestic cats why,askscience,fior9n
how did the sars 20022004 outbreak sarscov1 end,sorry if this isnt the right place couldnt find anything online when i searched it,askscience,gbquds
why although planes are highly technological do their speakers and microphones sound like old intercoms,edit okay i didnt expect to find this post so popular this morning cet as a fan of these things im excited to have so much to read about thank you,explainlikeimfive,nliql6
why does down syndrome cause an almost identical face structure no matter the parents genes,just curious,explainlikeimfive,rb6jv5
why does the body always wake up so early after a night of drinking,,explainlikeimfive,jzgznb
how calculators actually calculate things and how we know that the answers we get are accurate,,explainlikeimfive,1j5duch
why can you hear the sound of tap water changing temperature,turn on hot water it starts cold when it finally gets warm you can hear the change why,explainlikeimfive,ab2ncv
what are the most commonly accepted theories of consciousness among scientists today,,askscience,i8u481
if there is indeed microbial life on venus producing phosphine gas is it possible the microbes came from earth and were introduced at some point during the last 80 years of sending probes,i wonder if a nonsterile probe may have left earth have all but the most extremophile  adaptable microbes survive the journey or microbes capable of desiccating in the vacuum of space and rehydrating once in the venusian atmosphere and so already adapted to the life cycles proposed by seager et al 2020httpsarxivorgabs200906474,askscience,ixaqe9
why is food residue so hard to flush,particularly leafy vegetable type of foods ive noticed everytime i take a dump and ive eaten something leafy prior some of the greens come out intact instead of as poo then its such a pita when i try to flush them probably takes about 2 to 4 flushes on average until they go down the drain for good can someone explain the physics behind this cant be anything wrong with my toilet i dont consider the flushing particularly weak definitely not as strong as an industrial type the type you would find in a good office toilet but the pressure is strong enough that the poo is usually flushed down in one go,explainlikeimfive,1jazzso
how after 5000 years of humanity surviving off of bread do we have so many people within the last decade who are entirely allergic to gluten,,explainlikeimfive,6efne8
why do soldiers still learn to march even though that its not practical in actual combat,,explainlikeimfive,d1dj51
why do they say not to put a car battery on a concrete floor,the old wives tale has been proven anecdotally that putting a car battery on a concrete floor kills the charge is there any science behind this or is it coincidental,askscience,5putlx
which birds have hollow bones did dinosaurs have hollow bones,briefly went down a rabbit hole when i asked twitter so if youre a birds arent real person are chickens included in that statement and then i saw a post of a dinosaur depicted with feathersmore bird like and started wondering if dinosaurs also had hollow bones what ive found so far is that birds that have hollow bones have heavier skeletons due to increased bone density despite the air pockets ie a 2oz bird and a 2oz mouse the birds skeleton would be heavier also that its not every bone thats hollow and that diving birds have fewer hollow bones in comparison to birds that rely more on flight but yeah this just piqued my curiosity,askscience,1eedtdx
what are binaural beats and solfeggio tones and how can they supposedly impact your brain,i noticed these two audio options in my meditation app but cant quite understand what they are or how they can supposedly help during meditation not concerned with whether or not they actually do anything or if its pseudoscience yet just want to understand what they are,explainlikeimfive,1j3ni1a
the universe is made up of atoms which are made out of subatomic particles which are in turn made up of quarks do we know if this daisy chain stops or like a true fiveyear old will be always be asking and then what,,explainlikeimfive,b6l3g7
what caused the growing whining sound when old propeller planes went into a nose dive,im assuming it has to do with friction somewhere as the whine gets higher pitched as the plane picks up speed but im not sure where edit wow the replies on here are really fantastic thank you guys til the iconic divebomber diving sound we all know is actually the sound of a wwii german ju87 stuka dive bomberhttpsenwikipediaorgwikijunkersju87 it was the sound of a siren placed on the planes gear legs and was meant to instil fear and hopefully make the enemy scatter instead of shooting back heres some archive footagehttpsyoutube5uvqha42tu  thank you ubooleanradley for the link and info turns out we associate the sound with any oldschool divebombers because of hollywood this kind of makes me think of how we associate the sound of red tailed hawkshttpswwwyoutubecomwatchvnvbxlxyleyq screeching and calling with the sound of bald eagles they actually sound like thishttpsyoutubepq2umauybowt35 thanks to hollywood x200b thank you uringosis ukiwidaninja ubooleanradley uharlottesometimes and everyone else for the great responses edit 2 also check out uharlottesometimes and uunevensteams replies for more info uharlottesometimess replyhttpswwwredditcomrasksciencecommentsacvktewhatcausedthegrowingwhiningsoundwhenoldedbaowx uunevensteams replyhttpswwwredditcomrasksciencecommentsacvktewhatcausedthegrowingwhiningsoundwhenoldedbanoz x200b edit 3 the same idea was also used for bombshttpswwwyoutubecomwatchvxa0kmngbp5e thank you uoznog99 for the link,askscience,acvkte
is it possible a big wave to occur at the same time every day at the beach,im in greece at a beach by athens and every day at 254pm there has been an abnormally big wave arriving and going past the first few rows of umbrellas anyone know why this happens is this some sort of natural phenomenon,askscience,1f9kq4l
if you are in water right underneath the moon and the moon is at its closest do you float better than other places on earth,,askscience,ey7uja
why is it that you can keep a house phone on its charging dock for years and it doesnt destroy the battery where as a cellphone will eventually wither over just a couple years if you charge it for too long everyday,,explainlikeimfive,iquiso
why they dont immediately remove rubble from a building collapse when one occurs,,explainlikeimfive,o7lnhr
i imagine seals dolphins and other sea mammals drink seawater how good are their kidneys,,askscience,i70i8f
if tesla was on the path of making electricity be conducted through air like wifi how come we cant do it now since technology advanced so much,edit how about shorter distances not radiolike lets say exactly like wifi in order for me to charge my phone even when im 5 meters away from the charger right now wireless charging is even more restraining than cable charging,askscience,o5iqml
a chicken egg is 40 calcium how do chickens source enough calcium to make 12 eggs per day,edit there are differing answers down below so be careful what info you walk away with one user down there in tangle pointed out that for whatever reason there is massive amounts of misinformation floating around about chickens who knew,askscience,l8xdv7
why do snipers need a spotter,,explainlikeimfive,74f9nn
what keeps bed bugs in check why havent they taken over the world do they have any natural enemies they seem pretty unstoppable  easy breeders can live a long time without food can survive harsh conditions easy hitch hikers and they feed on an endless supply of human blood,,explainlikeimfive,av4u27
when youre asleep what part of the brain filters the noises you hear determining whether to wake up or not,,explainlikeimfive,5rttb1
if for some reason you have a handful of feces in your hand and you wash it off with disinfectant soap but your hand still smells like feces does that mean your hand is still contaminated,,askscience,aqyjdm
how does soldering and actually work,how does soldering something in a motherboard actualy sends the information to the board,askscience,1f59i60
how do we know how hot the core of the earth is and everything underground if the farthest we have dug a hole is just 8 miles,,explainlikeimfive,7a05al
if all human cells replace themselves every 7 years why can scars remain on you body your entire life,,explainlikeimfive,7j18sc
why are metals smelted into the ingot shape would it not be better to just make then into cubes so they would stack better,,explainlikeimfive,ok2a78
what has made solar energy so much more expensive in the past and what developments are most important to further reduce the cost in the future,,askscience,5kggms
how was a new organ just discovered,isnt this the sort of thing da vinci would have seen not really or someone down the line edit wow uh this made front page thank you all for your explanations i understand the discovery much better now,explainlikeimfive,887abh
how did plants reproduce before pollination,,explainlikeimfive,1j6x1oc
what is the ecological impact of toilet paper,,askscience,9w4iyv
changing state of matter using degeneracy pressure,if covalent bonds can be thought of as springs then can we compress the bonds together such that the repulsion cause by the electron degeneracy pressure causes the covalent bonds to release quickly and break like a spring furthermore how could we generate such pressures if this notion is conceivable at least in theory thankyou,askscience,1f9v0zs
how does rabies make a human hate water,,explainlikeimfive,1j9huhv
why is it healthy to strain your heart through exercise but unhealthy to strain it through stress caffeine nicotine etc what is the difference between these kinds of cardiac strain,,explainlikeimfive,uwl3ib
adhd brains are said to be constantly searching for dopamine  arent all brains craving dopamine whats the difference,,explainlikeimfive,y44mca
why do singleengine propeller aircraft with dihedral or gull wings selfright even when trimmed to maintain a lazy banking turn to loiter over an area,,explainlikeimfive,1ja30bq
can you use a regular compass on mars,,askscience,b0d7in
from my 7 year old do the things in our bodies ever get tired like cells and antibodies do they have to rest,,askscience,rgyvwm
can someone help translate whats been called the most beautiful paragraph in physics,here is the paragraph if one wants to summarize our knowledge of physics in the briefest possible terms there are three really fundamental observations i spacetime is a pseudoriemannian manifold m endowed with a metric tensor and governed by geometrical laws ii over m is a vector bundle x with a nonabelian gauge group g iii fermions are sections of s vrs vrvrvr r and r are not isomorphic their failure to be isomorphic explains why the light fermions are light and presumably has its origins in representation difference  in some underlying theory all of this must be supplemented with the understanding that the geometrical laws obeyed by the metric tensor the gauge fields and the fermions are to be interpreted in quantum mechanical terms  edward witten physics and geometry according to eric weinstein who i know is a controversial figure but lets leave that aside for now this is the most beautiful and important paragraph written in the english language you can watch him talk about it herehttpsyoutubevdw9xdbuxjut3079 or take a deep dive into his wikihttpstheportalwikiwikigraphwalltome could someone 1 literally translate the paragraph so a layman can grasp the gist of it switching the specific jargon in bold with simplified plain english translations just assume i have no formal education in math or physics so feel free to edit the flow of the paragraph for claritys sake for example something like if one wants to summarize our knowledge of physics in the briefest possible terms there are three really fundamental observations i spacetime is a pseudoriemannian manifold flexible 3dimension space m endowed with a metric tensor composite list of contingent quantities and governed by geometrical laws etc and 2 briefly explain the importance of this paragraph in the big picture of physics,explainlikeimfive,ga39ic
what happens to your voice if you dont speak for a very long time,im writing a story and a woman in the story is unfrozen after 2000 years not speaking for that amount of time obviously i was wondering if your voice would be completely gone due to that or if your voice would just be really hoarse,askscience,bw78ym
what are we currently doing to combat the year 2038 problem,,askscience,abhuvd
how much do we know about the carrying capacity of various dinosaur species,ie how many t rex were living on the earth at the same time or how many ultrasaurs could an area the size of south america have supported do we have a decent way of guesstimating that,askscience,1dvhiks
how am i supposed to interpret the projection of a 4d cube to be anything meaningful,i have a strong math background but with only a dabble of topology i took calculus twice in high school and did a book report for it on flatland which i appreciated quite a lot but every time i see one of these projections of 4d cubes i keep wondering what im supposed to glean i wouldnt explain a sphere to a flatlander as a small circle inside a larger circle i dont think theyd get it are there any insights into how this cube inside a cube would help me imagine a 4d cube,explainlikeimfive,1j7sgbd
i keep reading newest phones are almost more powerful than a steam deck what is stopping phones from running windowslinux or playing regular pc games natively,,explainlikeimfive,1j7txdg
how can canned meats like fish and chicken last years at room temperature when regularly packaged meats only last a few weeks refrigerated unless frozen,,explainlikeimfive,gma6tr
not sure how to quite phrase this but is there a sort of default position for human body parts,like the position each joint and limb returns to at complete rest or if like there were no external forces on it not sure if this makes question makes complete sense but i think you get the gist but im kind of wondering at whether some lounging positions are more harmful or unnatural than others despite feeling relaxing at the time,askscience,jocnxr
how is it known that everyone with blue eyes has one single ancestor rather than this mutation occurring in multiple individuals at many different times,,askscience,cbsfw2
how can we see light from the big bang when light moves away from us if i point a flashlight at something far away i will never see that light again once the flashlight is switched off the big bang switched off long ago,,explainlikeimfive,1j3fjc6
help us fight for net neutrality,the ability to browse the internet is at risk the fcc preparing to remove net neutrality this will allow internet service providers to change how they allow access to websites askscience and every other site on the internet is put in risk if net neutrality is removed help us fight httpswwwbattleforthenetcom,askscience,7etmk7
why does water in a kettle go quieter just as its about to boil,,explainlikeimfive,l4o82u
