title,body,subreddit,post_id
why is it that when we watch footage from the 70s a lot of times it looks better than footage of the 90s,i dont know what it is but it looks good and sharp despite being pixelated example httpswwwyoutubecomwatchvqffnlybfeiehttpswwwyoutubecomwatchvqffnlybfeie x200b edit oh shit this blew up thanks for all the answers i learned a lot d,explainlikeimfive,ivd7cz
why are some spicy foods felt in the mouth ie hot sauce and some felt in the sinuses ie wasabi,,explainlikeimfive,a0xncr
how do our bones know to grow to be the same length,i was discussing this with a friend yesterday and we were trying to work out how our bones know to grow to be the same length we were thinking that it could be something about timing the growth but might there would need to be some sort of feedback mechanism to control whether they are the same length but then i could see this working in the legs but not the arms this is all supposing that our bones do grow to be the same length though i suppose,askscience,1czga5y
types of fiber,what holds your crap together what makes it loose what helps you go and stay regular what stops the mail,explainlikeimfive,1j8fu34
when you dont eat for a period of time why do you sometimes feel nauseous to the point of not wanting to eat anymore,,explainlikeimfive,cnvbvv
on jupiter will more superstorms the size the great red spot eventually form or are the positions and types of storms relatively constant,hurricanes and big storms on earth move around and change size but does that happen on jupiter,askscience,6exgpt
is there a certain priority list for a severely damaged human body to heal itself,does human body have a priority list for healing the body for example if a human body has multiple fractures severed nerves multiple lacerated organs internal bleeding and cuts and bruises how does the body react to the healing process which of the wounds and damaged areas it starts to heal first i am aware of different kinds of shocks and reactions to the human body but lets cast those aside is it strictly related to dna only or is there some sort of other mechanisms the bodybrain uses,askscience,8i6844
if the blue pigment is so uncommon in nature where did we get the pigment to create paints in times such as the renaissance,,explainlikeimfive,8z1i1m
why prices are increasing but never decreasing for example food prices living expenses etc,,explainlikeimfive,uadovh
why does your body feel physically ill after experiencing emotional trauma,,explainlikeimfive,6y9qw9
why are arrest records and mugshots made publicly available before a guilty conviction is determined by the courts,wouldnt this paint a picture that the person is guilty before proving his innocence its possible that the wrong person was arrested and there is supposedly a presumption of innocence until proven guilty also wouldnt it just create a mob mentality and skew public judgment from a jury perspective,explainlikeimfive,8kbuio
came across this fact while browsing the net i call bullshit can science confirm,if you have 23 people in a room there is a 50 chance that 2 of them have the same birthday,askscience,3j81fq
major league baseball batting strategy are they simply trying to hit a home run every time is there more to it than that,,explainlikeimfive,69ehab
are the symptoms of an illness the illness itself or your body reacting to it,im listening to the stand by stephen king and absentmindedly started wondering about what causes the symptoms of an illness i want to know if the symptoms are your bodys reactions to the illness the illnesss reaction to invading and fighting with your body or a combination of both for instance the buboes you develop during the bubonic plague is this a defense mechanism your body constructed to fight off the illness like a fever or inflammation or is it purely the bacterias programmed method of propagating and spreading throughout the body when i develop the pox are the pox on my body my bodys doing or the virus i know this may seem like a silly question but im curious i figured the subreddit was the best place to get a solid answer please and thank you,askscience,1etsf2h
why do marvel movies and other heavily cgi and animationbased films cost so much to produce where do the hundreds of millions of dollars go to exactly,,explainlikeimfive,bfxz9t
whats the difficulty in making a pill that actually helps you lose weight,i have a bit of biochemistry background and kind of understand the idea but im not entirely sure i do remember reading they made a supplement that uncoupled some metabolic functions to actually help lose weight but it was taken off the market thought itd be cool to relearn and gain a little insight thanks again edit wow this is a lot to read i really really appreciate yall taking the time for your insight ill be reading this post probs for the next month or so its what im currently interested in as im continuing through my weight loss journey,askscience,kl1wk6
how does blood circulate through your body after youve had an amputation,,explainlikeimfive,64zwwz
what makes permanent markers more permanent than regular markers,,explainlikeimfive,mmowjo
what causes proteins to misfold,so im assuming theres a reason why proteins fold the wrong way other than bad luck oops im also assuming the body misfolds proteins all the time but has a way to destroy them in case it isnt clear im referring to prions here so what causes proteins to misfold how does the body destroy a misfolded protein and at what point does a misfolded protein become a prion and thus becomes at risk for misfolding other proteins,explainlikeimfive,1ja88bu
when inside a large group of people at a stadium concert festival why does your phones internet data stop working despite having full bars why does such a large presence of phones in one area limit every phones usability and ability to even simply send a text message,,explainlikeimfive,dl7ve0
what determines the lifespan of a species why do humans have such a long lifespan compared to say a housecat,,askscience,7kq5r4
why does food only release its nutrients if cooked like say sprouting beans and stuff arent all the nutrients already there,it is hard for me to articulate what i mean exactly but if all the amino acids and whatnot are present why does changing the processing nature affect how easy it is to digest,explainlikeimfive,1j3wbr2
how do rv dealerships really work every dealership it seems like hundreds of rvs are always sitting on the lot not selling through year after year car dealerships need to move this years model to make room for the next why arent dealerships loaded with 5 year old rvs that didnt sell,,explainlikeimfive,t4dhfr
why is it so important to finish the whole course of antibiotics,hey guys so i got into this debate with my friend who told me he stops taking his antibiotics once he starts feeling better naturally i was horrified but when he kept questioning it i couldnt really explain why it was so important for him to take the full course could anyone explain what the dangers are when people dont finish their prescribed course of antibiotics edit thank you so much for all the comments and resources ill pass them on to my friend and hopefully hell believe its more than just big pharma propaganda lol edit 2 for everyone saying my friend sucks i completely understand but my friend is not a scientist he was ignorant to how antibiotics work and why it was important to keep taking medicine after he stopped feeling sick i would say his opinion represents the majority of people who dont really think deeply about these things the big pharma propaganda argument was a bit stupid but im sure if he was aware of the dangers he would finish his antibiotics,askscience,el35q2
what actually causes inflation,the cost of living keeps rising but what is the actual root cause you can argue that company as cost of raw products which they purchase from company b increases so they have to increase their prices meanwhile company bs costs went up on anything they buy from company c which just repeats on and on i am completely lost on what the actual root cause is and i believe a lot of people to be in the same boat but it isnt something we think about because at this point we just accept that the cost of living increases every year but why does it,explainlikeimfive,1j5asix
with all this fuss about net neutrality exactly how much are we relying on america for our regular global use of the internet,,askscience,7ez85x
the freezing point of carbon dioxide is 785c while the coldest recorded air temperature on earth has been as low as 92c does this mean that it canwould snow carbon dioxide at these temperatures,for context the lowest temperature ever recorded on earth was apparently 1336f 92c by satellite in antarctica the lowest confirmed air temperature on the ground was 129f 89c wiki link to sourceshttpsenwikipediaorgwikilowesttemperaturerecordedonearth so it seems that its already possible for air temperatures to fall below the freezing point of carbon dioxide so in these cases would atmospheric co2 have been freezing and snowing down at these times thanks for any input,askscience,98b7jf
how can our brains remember that we forgot something but it cant remember what we forgot,,explainlikeimfive,ggul9k
why do engineers blast through hills instead of building highways over them,cant get back to all the comments thanks all 3 edit i used hills and not mountains on purpose lol cmon guys im not that clueless tunnels absolutely do not figure into my question thank you everyone for answering this has been enlightening edit 2 i dont think it has occurred to some browsers of this sub that the people asking these questions have probably considered their own question and come up with hypotheses already trust me i had 2 hours longer to drive and think after i posted the question at a gas station haha eli5 has confirmed some of my hypotheses about this and also added many new pieces of information to the puzzle which i am grateful for some of you taking time out of your day to say stupid question or something along those lines please dont consider becoming teachers and go forth in this sub operating under the assumption that a lot of the questions asked here are not just asked out of curiosity but also just seeking confirmation of hypotheses before going out into the world and spewing bs lol,explainlikeimfive,loz0w0
coronavirus megathread,this thread is for questions related to the current coronavirus outbreak the centers for disease control and prevention cdc is closely monitoring developments around an outbreak of respiratory illness caused by a novel new coronavirus first identified in wuhan hubei province china chinese authorities identified the new coronavirus which has resulted in hundreds of confirmed cases in china including cases outside wuhan city with additional cases being identified in a growing number of countries internationally the first case in the united states was announced on january 21 2020 there are ongoing investigations to learn more  cdchttpswwwcdcgovcoronavirusindexhtml china coronavirus a visual guide  bbc newshttpswwwbbccomnewsworld51235105 washington post live updateshttpswwwwashingtonpostcomworldcoronaviruschinaliveupdates202001244e678f9c3e0311eaafe2090eb37b60b1storyhtml all requests for or offerings of personal medical advice will be removed as theyre against the raskscience rules,askscience,etkdx1
why cant you spend dirty money like regular untraceable cash why does it have to be put into a bank,in other words why does the money have to be laundered couldnt you just pay for everything using physical cash,explainlikeimfive,mzsrmj
why is diesel no longer green,when i was growing up diesel was always considered the greener option than petrol and this was reflected in the prices diesel always cost less because it was taxed at a lower rate now they say its worse than petrol and prices are now higher for diesel so what changed or what did we suddenly learn about diesel that we didnt know before bonus question considering theyre both made from crude oil whats the difference in how theyre refined,explainlikeimfive,lqy0we
how do truth tables work,im kinda stuck on chapter one of discrete mathematics and its applications i understand bits of the logic and or xor and so on the individual parts make sense its just filling them out is what im struggling with the formatting translating it to english the lectures arent helpful and the books isnt the best its just this little bit i need to connect the dots then i can do the practice on my own to fully learn this stuff any and all help would be appreciated sorry about my grammar im on one brain cell right now,explainlikeimfive,1j9bgls
can an american grey squirrel reproduce with an english grey squirrel,ie are they still considered the same species or have they been separated long enough that are two different species,askscience,1dob2zv
how does pee come out so strong,,explainlikeimfive,1j5jc1v
biophysics of snot,i have a cold one symptom is that my nose is stuffed it suddenly went from not coming out no matter how hard you blow to running like tears down my face why is there any way to induce the thin state when im about to blow my nose admittedly the thick state is useful when sleeping,explainlikeimfive,1j9o4n1
how do bacteria targeting vaccines like pneumovax work,i was due for pneumovax today and as i left the clinic i realized heywait a minute isnt pneumonia also a bacterial thing before i could ask any way i tried reading the wikipedia entry on it and it does indeed safeguard against bacterial strains responsible for pneumonia im not getting any explanation anywhere close to the simplicity of understanding viral vaccines inactivated and live attenuated when reading about it was just curious thanks,askscience,1ed37cj
do any other species besides humans bury their dead,,askscience,a5ioiz
how do hostile takeovers work is there anything stopping jeff bezos from just buying everything,,explainlikeimfive,tx1fpv
does working out for 10 minutes every day do anything or do you have to do a minimum amount of exercise to see any benefit,i know obviously more activity is better im just curious if theres a minimum threshold for health benefits if someone goes from sitting every day to running 10 minutes every day will they see improvement or do they need to runliftswim etc for an hour edit just to clarify not looking for advice on how to get myself in shape or anything just curious about exercise limits and benefits or lack there of of small activities,explainlikeimfive,qyhjwz
why do clothes feel crunchy when you air dry them but soft out of the dryer,,askscience,6xpwcp
why is the loudest sound ever reported is considered to be the krakatoa volcanic eruption at 180 db and could be directly heard 5000km away but rocket launches regularly hits 200 db but are only heard within the vicinity of the ignition,,explainlikeimfive,n3vy6t
why do computers and game consoles need to restart in order to install software updates,,askscience,7mmz8i
how do third party headphones with volume control and playpause buttons send a signal to my phone through a headphone jack,i assume theres an industry standard and if so who is the governing body to make that decision,askscience,696mv5
why is the rising cost of housing considered good for homeowners,i recently saw an article which stated that for homeowners their houses are like piggy banks but if you own your house an increase in its value doesnt seem to help you in any real way since to realize that gain youd have to sell it but then youd have to buy or rent another place to live which would also cost more it seems like the only concrete effect of a rising housing market for most homeowners is an increase in their insurance costs am i missing something,explainlikeimfive,umuygs
if sarscov2 is an rna virus why does the published genome show thymine and not uracil,link to published genome herehttpswwwncbinlmnihgovnuccorenc045512 first 60 bases are attaaaggtt tataccttcc caggtaacaa accaaccaac tttcgatctc ttgtagatct,askscience,g08se2
why do we have a white half moon at the top of our fingernails,,explainlikeimfive,i5mhyt
how do the ships bear the huge weight of anchor chains for a very deep ocean,i have seen the massive anchor chain going down speedily but how the ship bears the weight of very long chains for deep oceans like 12k feet or so couldnt it be a big burden,explainlikeimfive,1j82a2c
if energy cant be created or destroyed what happens to it,today whilst running a hot water tap i started thinking about the energy used to create the hot water i remembered back to physics  and perhaps im remembering it wrong but energy cant be created or destroyed just transferred so my thought process went along the lines of stored energy in gas is transferred to the water causing it to heat thermal energy in the water escapes and enters the room this heat escapes the building and to the outside where would the energy go next and what would its next form be searching on the internet for an answer gave another where does the energy go thought  the example given was a car with stored chemical energy which is then converted into kinetic energy via the engine to move the car where does this energy then go edit  thanks for all the answers today i learnt that heat is the lowest form of energy and often considered used when converted to heat this heat radiates from the earth to space eventually,explainlikeimfive,1jbfe4y
if energy cannot be created or destroyed than how does gravity constantly pull things down,,explainlikeimfive,1j8cwdw
how point systems like on snapchat and reddit motivate people to participate even though they contribute no tangible value like money or rewards,,explainlikeimfive,6m4neu
you know how leds and solar panels are diodes,what happens if you feed a solar panel energy does it light up i had trouble googling it i either find leds being turned into solar panels or i cant find someone dumb enough to ruin solar panels that tested it lol whats the deal here do they emit non visible light colors the human mind cant comprehend just curious,askscience,1eo5abj
why didnt the h1n1 pandemic affect the world as much as covid19 did and still is affecting it massively,,askscience,j8lgfz
just how swampy was the carboniferous,i know that there was a lot of swampland during the carboniferous but i cant find anything on just how much of the world was swampy at the time was it just one big swampland broken up by mountain ranges or were there other biomes,askscience,1e9yu5k
why do we tend to listen to a new song that we like over and over again and then we cant stand hearing it anymore,,explainlikeimfive,jmayjr
how can we hear the voice in our head and how is it produced,editholy crap thanks for all the up votes and info you guys provided,askscience,6w956o
why do hamsters and possibly other rodents too sometimes freeze motionless for seemingly no reason,,explainlikeimfive,mq2tm0
can someone explain what abstract reasoning is to me,and how its related to iq,explainlikeimfive,fberov
why does working a muscle to exhaustion with low weight and high volume vs high weight and low volume yield different results,why wouldnt doing 200 reps of a 10lb dumbbell result in strength and hypertrophy gains even though im doing more stretching and contracting and still working to exhaustion edit well then this blew up last night lol a ton of great replies and a lot of information showing just how much information there is to know and still learn about the human body as most truths with our physiology are still just accepted theories big thank you to ucthulhubert for the great response spawning the 3rd best analogy to use midgets that ive ever seen,explainlikeimfive,4z1xls
how many times has the average drop of water been through an animal kidney in the history of earth,,askscience,dd5s24
i have a theory if there is an infinite amount of negative numbers and there is an infinite amount of positive numbers then the total amount of numbers would be odd because 0 is in the center for every positive number there is an negative counterpart am i right can we prove this with math,,askscience,ea0opz
how was the great american interchange possible if panama is known to be impossible to cross,,askscience,1f9uoog
askscience ama series im emily calandrelli i have 4 degrees in science and engineering and im the host and coexecutive producer of emilys wonder lab on netflix  ama,hi im emily calandrelli im the host and coexecutive producer of the new netflix show emilys wonder lab my bachelors is in mechanical and aerospace engineering from west virginia university and i have masters in aeronautics and astronautics as well as technology and policy from mit i have been working as a science tv show host childrens book author and public speaker for the last 7 years ama ill be on at 2 pm et 18 ut ama username uemilycal,askscience,isiqk1
why is it necessary to wipe the skin with an alcohol wipe when receiving any type of injection or having blood drawn but it isnt necessary for a shot in the mouth,edit i know why an alcohol wipe iswas necessary when i asked this question i just used it as a comparison to get across the meaning of the second part of my question i was just wondering about the mouth injection and thought id ask it here this was actually the first thing ive ever posted on reddit and i didnt expect such a huge response thank you all,explainlikeimfive,ka3w3z
didnt the constant rpm playback mechanism of old tapes or records mean that the audio quality got worse as you got towards the slower end of the recording,,explainlikeimfive,1j7049t
why are some viruses like corona or the flu one and done while others like herpes or hiv can last your entire life,edit apparently my phrasing was a little confusing by one and done i meant generally you catch the virus like flu and its gone from your body in a couple weeks as opposed to hiv which lasts your life and is constantly symptomatic i did not mean that its impossible to catch the flu again,askscience,hhmcld
how can two singers sing the same song in the same key still have distinguishable voices,this is actually question my daughter posed and im pretty stumped she asked how if two people with lets say perfect pitch sing a song how is it possible that we can still tell who is singing when the notes would be identical note i know absolutely nothing about music but figured this was the best place to ask for her edit wow many of these answers are incredible i had no idea this would receive such in depth and thoughtful feedback i have learned a huge amount i was not exaggerating above when i said i know nothing about music i dont even know what pitch is  just quoted my daughter on that and im grateful to those of you who took the time to help me learn,explainlikeimfive,kpxv2g
after seing the meme of a guy going back in time and unable to answer to the question how is this socalled electricity made im actually really asking myself the question,,explainlikeimfive,kxqq97
why do almost all fm radio frequencies have an odd decimal value for example 1003 915 1011,,explainlikeimfive,b3lh5g
do spiders ever take up residence in abandoned webs,,askscience,jw9lrt
how does etfs and dca work,helloi am trying to learn about etfs and dcahow does it work,explainlikeimfive,1j5kq8p
what are stock buyback initiative and why do ceoscompanies seem to love them so much,,explainlikeimfive,1j82l73
in interstellar shouldnt the planet endurance lands on have been pulled into the blackhole gargantua,the scene where they visit the waterworldesque planet and suffer time dilation has been bugging me for a while the gravitational field is so dense that there was a time dilation of more than two decades shouldnt the planet have been pulled into the blackhole i am not being critical i just want to know,askscience,f1r275
ice burns make no sense to me on a molecular level your skin cells are damaged because they came in contact with molecules that move too slowly,you can damage your skin via conduction on too hot and too cold objects 5c  54 c now i can somewhat understand how fast moving molecules can damage cells but what causes the skin cells to be damaged after being in contact with slowly moving molecules does the water in cells and blood freeze if so what happens to the frozen cell when thawing,askscience,o6ysqw
how does shocking the body kill someone but also save someone,how come electrocution can put someone in cardiac arrest but also kick them out of it im assuming it has to do with the quantity of voltage,askscience,1d0umrt
if a person catches a cold and covid19 at the same time will that person get seriously sick from both illnesses or one of the viruses will win the fight against the other,,askscience,n5qoyq
why is grief so physically exhausting,,explainlikeimfive,k7ml8v
how can ethernet cables that have been around forever transmit the data necessary for 4k 60htz video but we need new hdmi 21 cables to carry the same amount of data,,explainlikeimfive,12svc4m
can proteins theoretically synthesize any molecule,can it for example synthesize cccc or any molecules with triple bonds can we map a protein in which it achives a certain function,askscience,1djnwlz
why do the two covid19 vaccine candidates require different storage conditions,today news came out about the moderna vaccine candidate which can be stored in a normal 20c freezer and for some time in a normal refrigerator last week news came out about the pfizer vaccine candidate which must be stored in a deep freeze 80c until shortly before use these two vaccine candidates are both mrna vaccines why does one have more lax storage conditions than the other,askscience,jv6vud
emile durkheims theories in context of law,,explainlikeimfive,1j87xb5
