title,body,subreddit,post_id
how does wood become petrified,just curious how some wood can become stone while most just decomposes,askscience,1etxx2w
why do we feel nostalgia so strongly for things we didnt even like as kids,okay so when i was little i hated waking up early for school i dreaded those cold mornings the sound of my alarm and rushing out the door halfasleep but now when i hear an old school bell sound or smell a certain kind of breakfast i get this weird nostalgic feeling like i miss it why does our brain do this why do we romanticize things we used to dislike is it just time making everything seem better or is there some science behind it,explainlikeimfive,1j4pagx
what does the tpp transpacific partnership mean for me and what does it do,in light of the recent news about the tpp  namely that it is close to passing  we have been getting a lot of posts on this topic feel free to discuss anything to do with the tpp agreement in this post take a quick look in some of these older posts on the subject first though while some time has passed they may still have the current explanations you seek  eli5 what are the implications of the recently leaked draft of the tpp intellectual property rights chapter httpwwwredditcomrexplainlikeimfivecomments1qj9eneli5whataretheimplicationsoftherecently  eli5 what is the trans pacific partnership tpp what are its pros and cons how will it affect ushttpwwwredditcomrexplainlikeimfivecomments23ubdyeli5whatisthetranspacificpartnershiptpp,explainlikeimfive,3az0fa
why do blacksmiths need to hammer blades into their shape why cant they just pour the molten metal into a cast and have it cool and solidify into a bladeshaped piece of metal,,explainlikeimfive,hmhi4j
why does multiplying two negatives give you a positive,thank you guys i kind of understand it now also thanks to everyone for your replies i cant read them all but i appreciate it oh yeah and fuck anyone calling me stupid,explainlikeimfive,3r90cw
how are ozempic and wegovy the same drug semaglutide but treat two different things,is it just marketing or semantics they are both administered weekly with similar doses yet insurance companies will die on the hill that you cant have ozempic if youre not type 2 diabetic is there something else in the drug that makes it work different or is it just ozempic has bigger doses if there isnt a functional difference besides dose size its like saying you can only take advil if you have migraine but can take ibuprofen for anything else,askscience,1dm7ly4
how do scientists know mitochondria was originally a separate organism from humans,if it happened with mitochondria could it have happened with other parts of our cellular anatomy,askscience,11u91h3
the calculation which dictates the universe is 73 dark energy 23 dark matter 4 ordinary matter,,explainlikeimfive,5zore3
why do hot water and cold water sound different when you slosh them around,,askscience,1d1q74u
how do we know what names mean eg hercules wife was called deinara which means husband destroyer in ancient greece was this woman literally called husbanddestroyer,,explainlikeimfive,a3b65p
what is the infection fatality rate from covid 19 if you are fully vaccinated,,askscience,pjk4ez
how did old forts actually protect a strategic area couldnt the enemy just go around them or stay out of range,ive visited quite a few colonial era and revolution era forts in my life theyre always surprisingly small and would have only housed a small group of men the largest one ive seen would have housed a couple hundred i was told that some blockhouses close to where i live were used to protect a small settlement from native american raids how can small little forts or blockhouses protect from raids or stop armies from passing through surely the indians could have gone around this big house how could an army come up to a fort and not just go around it if theres only 100 men inside tldr  i understand the purpose of a fort and its location but i dont understand how it does what it does,explainlikeimfive,dvs33x
is it possible to put my bare foot on the moon,,askscience,74vncq
why is our brain programmed to like sugar salt and fat if its bad for our health,,explainlikeimfive,5xve3i
vertebrates have haemoglobin in the blood and myoglobin in muscles what do invertebrates which use haemocyaninetc in place of haemoglobin use in place of myoglobin,before anyone says so in the comments yes i am aware that the phrasing probably erroneously implies that haemoglobinmyoglobin is the default  conservative phenotype and the others are innovative replacements but i was trying to be as concise as possible for the sake of readability,askscience,1eu26uj
if a 20 year old gets an organ transplant from a 50 year old 30 years later is that organ functioning as if it were 80 years old or 50 years old,,askscience,akzk33
why is the congo river so deep,i just read that the congo river is like 220m deep the nile apparently is only about 8 to 11 m deep on average and it is double the amazons 100m i mean 220m is basically the depth of lake huron motherfucker is deep but  why,askscience,7j0adq
whats the benefit of calculating pi to now 628 trillion digits,,explainlikeimfive,p5ynq0
why do we use pillows now when we sleep did we need this during the prehistoricancient age what changed,,askscience,85kaz5
is there a physics based limit to how large a planet can be,uy scuti is a red supergiant star with a radius of 1188 billion kilometers or 1708 times larger than the sun it doesnt seem reasonable to think that their could possibly be a telluric planet 1708 times larger then earth and of course there is not as much data on exoplanets as of yet to have some hard evidence yet of some potential planet sizes is there any physics based science that would show that there are upper limits for either rocky or gas planets,askscience,1eqwfse
what do they mean when they say jupiter is a gas planet could a rocket be shot through it could an astronaut or spacecraft land on it,,explainlikeimfive,4th2bb
why does plastic turn white when you bend it,,explainlikeimfive,aek510
if i enter a password wrong thrice the system locks me out how are hackers able to attempt millions of combinations of passwords without the system locking them out,edit thank you everyone whos taken out time to explain it to me ive learnt so much appreciate it yes i do use thrice in my conversation whenever required im glad it amused so many of you,explainlikeimfive,h98tzm
does lightning strike more often at higher elevations,theres a storm right now and lightning struck close enough i felt it and that seems to happen a lot more here than it did in nebraska,askscience,1f599ob
why were ridiculously fast planes like the sr71 built and why hasnt it speed record been broken for 50 years,,explainlikeimfive,ircby5
when would the atomic number not equal the proton number,i had assumed they were interchangeable terms but on wikipedia i just read the atomic number or nuclear charge number symbol z of a chemical element is the charge number of an atomic nucleus for ordinary nuclei composed of protons and neutrons this is equal to the proton number np or the number of protons found in the nucleus of every atom of that element what kind of unordinary nucleus would make these different is there something else in the nucleus included in the atomic but not the proton number,askscience,1ene6es
askscience panel of scientists xxvi,please read this entire post carefully and format your application appropriately this post is for new panelist recruitment the previous one is herehttpswwwredditcomrasksciencecomments198hzvnasksciencepanelofscientistsxxv the panel is an informal group of redditors who are either professional scientists or those in training to become so all panelists have at least a graduatelevel familiarity within their declared field of expertise and answer questions from related areas of study a panelists expertise is summarized in a colorcoded askscience flair membership in the panel comes with access to a panelist subreddit it is a place for panelists to interact with each other voice concerns to the moderators and where the moderators make announcements to the whole panel its a good place to network with people who share your interests  you are eligible to join the panel if you  are studying for at least an msc or equivalent degree in the sciences and  are able to communicate your knowledge of your field at a level accessible to various audiences  instructions for formatting your panelist application  choose exactly one general field from the sidebar physics engineering social sciences etc  state your specific field in one word or phrase neuropathology quantum chemistry etc  succinctly describe your particular area of research in a few words carbon nanotube dielectric properties myelin sheath degradation in parkinsons patients etc  give us a brief synopsis of your education are you a research scientist for three decades or a firstyear phd student  provide links to comments youve made in askscience which you feel are indicative of your scholarship applications will not be approved without several comments made in raskscience itself  ideally these comments should clearly indicate your fluency in the fundamentals of your discipline as well as your expertise we favor comments that contain citations so we can assess its correctness without specific domain knowledge heres an example application username uforetopsail general field anthropology specific field maritime archaeology particular areas of research include historical archaeology archaeometry and ship construction education ma in archaeology researcher for several years comments 1 2 3 4 please do not give us personally identifiable information and please follow the template were not going to do reallife background checks  were just asking for reddits best behavior however several moderators are tasked with monitoring panelist activity and your credentials will be checked against the academic content of your posts on a continuing basis you can submit your application by replying to this post,askscience,1e73crx
if bruises are from bleeding underneath the skin where does all the blood go when it heals,,askscience,fkhtzw
does antihydrogen have the same orbital sizeshape as hydrogen,not sure if physics may be a more appropriate flair  i apologize if i misflaired this post would antihydrogen ie the antimatter counterpart of hydrogen have the same orbital levels and shapes as regular hydrogen would a more complex structure like antioxygen we havent synthesized this yet as far as i know  so theoretically have the same shapesize orbitals as normal oxygen while thinking about this i was also wondering if antihydrogen would be considered an element as a side question would we need to redo the periodic table to accommodate these antimatter elements thank you,askscience,1f2lcxc
why do people seem to age so incredibly fast after a traumatic experience,for example a woman i know seemed to have aged at least ten years in a very short time after her grandchild died in an accident,explainlikeimfive,jth16v
what exactly a data analysist do,i heard a lot about data analysis as a career choice but i have never fully understand what exactly do they do within a company what data do they analyze are they in charge of gathering it i have so much questions,explainlikeimfive,1j7l8nm
are all birds decended from one species that evolved to the variety we see today or did multiple species of birds survive the dinosaur extinction,finches ostrich robins parrots eagles penquins and so many more some have curved beaks others have pointy do our modern birds share a common ancestor that survived the extinction then diverged and evolved or is the variety of birds do to them already on divergent paths and each survived if so do we have any idea how many surviving branches there are,askscience,1exd4mb
why did it take 1 year to construct the empire state building in 1930 but 7 years to construct one world trade center in modern times,shouldnt modern technology speed up the construction process,explainlikeimfive,4lhzxi
why do the fastest bicycles have really thin tyres but the fastest cars have very wide tyres,,explainlikeimfive,lucq3s
derivatives the usa has 687 trillion dollars of currency and credit derivatives what exactly does this mean,,explainlikeimfive,hp9dqv
why do we retain memories if all of our cells replace themselves after a small amount of years,,explainlikeimfive,lixl1w
how exactly does water put out a fire is it a smothering thing or a chemical reaction,,explainlikeimfive,gnaxct
is it possible for a planets moon to share an atmosphere with the planet,if a planets atmosphere extends far enough and one of the planets moons were close enough could it share the planets atmosphere,askscience,4llimj
how are new oil fields discovered take guyana as a recent example a country with minimal oil production how were suddenly huge previously unknown oil fields found,basically title i would like to know what the science or work process is behind how oilgas fields are discovered if a country say usa or saudi arabia are already overflowing with reserves and have similar geology and geological history it makes sense to me that new reserves are found there but what about places on earth that were not captured yet such as the north sea round 50 years ago or oil from south america from places that were previously unknown how are these fields discovered and bonus question how do we know the size of these fields how are probably size estimates calculated,askscience,1ebt30e
many animals have larger brains than humans why arent they smarter than us,the human brain uses a significant amount of energy that our relatively small bodies have to feed compared with say whales elephants or bears they must have far more neurones  why doesnt that translate to greater intelligence a rhino or hippo brain must be huge compared with humans but as far as i know theyre not especially smart why not,askscience,1elako0
why do clones die so quickly,for example dolly or that extinct ibex goat that we tried bringing back why did they die so quickly,askscience,i29bhr
didnt the person who wrote worlds first compiler have to well compile it somehowdid he compile it at all and if he did how did he do that,,askscience,9wex4k
do any differences arise from the huge age difference between the eastern and western us seaboards,question popped up in my head after seeing a map of pangaea and realizing that california washington oregon have been coastal for about an extra 100 million years while florida new york and the carolinas were landlocked until the split so could that extra 100 million years have lead to differences we can seemeasure today for example could the west coast have bigger or deeper water aquifers due to the millions of years of hurricanes dumping water inland that the east coast didnt get could the soil be saltier due to tidal flooding could there be more offshore oil on the west coast due to the extra 100 million years of whales sharks plankton and other sea life or larger calcium deposits from the extra shellfish species,askscience,1em9cbe
fossil caves not cave fossils,are there known fossilized caves im not talking about fossils in caves although id be interested in those as well im talking about caves that filled in with sediment were buried and later eroded to the surface millions of years later and if they exist has anything interesting been learned from them i havent had much luck searching for information edit just to provide an example of the sort of thing i am thinking about i am imagining something like a layer of limestone laid down in the paleozoic eroded as karst in the mesozoic forming a cave perhaps containing stalactites or even fossils of animals that wandered inside and died then filled in with sediment buried and later discovered in the modern day,askscience,1ew4puk
why is a swab required to be inserted deep into your nasal cavity to determine a positive or negative covid case yet it can be spread merely by speaking too close to somebody,,askscience,hm9zmw
the difference between the dow nasdaq and sp 500,,explainlikeimfive,ifxvet
the recent fire in london was traced to an electrical fault in a fridge freezer how can you trace with such accuracy what was the single appliance that caused it,edit thanks for the informative responses and especially from people who work in this field lets hope your knowledge helps prevent horrible incidents like these in future edit2 quite a lot of responses here also about the legitimacy of the field of fire investigation i know pretty much nothing about this area so hearing this viewpoint is also interesting i did askscience after all so the critical points are welcome thanks all,askscience,6j0tg2
how do rain sensing wipers work,for example sometimes its not raining and backing out of my driveway makes it trigger and sometimes its actually raining and they wont trigger,explainlikeimfive,1j7fgxp
are genitalia sexualized differently in cultures where standards of clothing differ greatly from western standards,for example in cultures where its commonplace for women to be topless are breasts typically considered arousing there surely still are and at least there have been small tribes where clothing is not worn at all is sexuality in these groups affected by these standards a relation could be made between western nudist communities are there native or nonwestern cultures that commonly fetishize body parts other than the western standard of vagina penis butt and breasts if so is clothing in any way related to this phenomenom most importantly if i was to do research on this topic myself is there even any terminology for sexuality of a culture relating to clothes thank you in advance of any good answers,askscience,ah0fj9
how can a tiny pimple can hurt a whole shoulder,,explainlikeimfive,i8je5o
how deep is the sahara deserts sand and whats at the bottom of the sand,like is it a solid bedrock kind of surface or is it a gradient where the sand gets courser and courser until its bedrock edit my biggest post so far and its about how deep sand is and then it turns out more than half of it isnt sand oh well,askscience,qnk8ik
why is einsteins emc2 such a big deal that everyones heard of it how important was that discovery actually is it like in the top 3 most important discoveries of all time or is it kind of overhyped,,explainlikeimfive,xb8882
the coldest recorded temperature on earth was 892 degrees c could co2 have precipitated out of the atmosphere,selfexplanatory at that temperature we are well below co2s freezing temperature would it precipitate out of the atmosphere as co2 snow or would the sunlight immediate ablate it back to a gaseous form what about the gradient between neighboring air masses if the 89 degrees area is surrounded by 70 degrees further away would the co2 flow into the colder area due to the difference in concentration could we harness this principle to precipitate co2 out of the atmosphere by permanently creating extremely cold localized spots precipitating then collecting and storing that co2,askscience,1eeyk4u
is it possible to use seismic in this case from asteroid impacts monitoring to learn what the moon is made out of,since theres no tectonics on the moon and presumably no geologists can we land seismic monitoring devices around the moon to monitor impacts from asteroids to identify the innards of the moon if such a set up is possible would we also need to be watching the moon to see the asteroid impact in question to be able to interpret the seismic data properly as in the sizevelocity and impact location putting earth science flair down because i thought this is more geology than anything else,askscience,1dsrnaj
is there any validity to the claim that epsom salts increase the relaxing effects of a warm bath after strenuous exertion if so what is the underlying mechanism for this effect,this claim is printed in wide type on this box of es weve got  my baloney detector is tingling editupdate just a reminder to please remain on topic and refrain from anecdotal evidence and hearsay if you have relevant expertise and can back up what you say with peerreviewed literature thats fine sidediscussions about recreational drug use effects on buoyancy sensory deprivation tanks and just plain old off topic ramblings while possibly very interesting are being pruned off as offtopic as per sub policy so far what im taking of this is that there exists some literature claiming that some of the magnesium might be absorbed through the skin thank you user ulocused but that whether that claim is credible or not or whether the amounts are sufficient to have an effect is debatable or yet to be proven as pointed out by several other users,askscience,65vy4z
how do smelling salts wake you up after youve been unconscious,also as a side note could you sniff them to keep you awake,explainlikeimfive,7eynab
why do opposite charges attract and like charges repel,,explainlikeimfive,1jayyjw
how fast can a submarine surface,so i need some help to end an argument a friend and i were arguing over something in aquaman in the movie he pushes a submarine out of the water at superspeed one of us argues that the sudden change in pressure would destroy the submarine the other says different who is right and why thanks,askscience,a70lku
where do the photons go after the light is turned off in the room,,askscience,g1603c
how do conferencing programs like zoom handle so many different screens so quickly when sometimes single videos in other apps lag,,explainlikeimfive,n0xt4q
how does different masses of a radioactive substance have the same half life,consider two masses of uranium 238 10 kg and 50 kg after 45 billion years the first will become 5 kg while the second will be 25 kg how does 5x particles decay in the second mass,explainlikeimfive,1jandcd
why are vitaminschemical like synthetic caffeine healthier when derived from whole food sources,other than a lack of bioavailability are there other negatives when you ingest residual chemicals from synthesis from some products more than others is there a way to tell if some synthesis are moreless harmful than others based on the processes used ex methylation vs decarboxylation is there a chart somewhere that would show common processes and common biproducts,explainlikeimfive,1j7y3dj
why do small animals like squirrels not lose appendages to frostbite when temperatures reach below freezing and they walk around on ice and snow all day,,explainlikeimfive,lldyam
why does congo have a near monopoly in cobalt extraction is all the cobalt in the world really only in congo or is it something else congo produces 80 of the global cobalt supply why only congo is the entirety of cobalt located only in congo,,explainlikeimfive,lkzmqc
why is it impossible to transplant a bladder it seems strange to me that a heart can be transplanted and a bladder cant,,explainlikeimfive,m9g858
why are primates incapable of human speech while lesser animals such as parrots can emulate human speech,,askscience,7omaq1
is ocean salinity specific to conditions on earth or would other planets with liquid water have salty oceans with fresh water rivers and lakes,im wondering if there is something with ocean mechanics that cause them to have higher salinity such that most planets with liquid water should be expected to have salty oceans or is there something about earth that causes the salinity and it isnt necessarily always the case,askscience,1cvz9fk
when an intraplate strikeslip fault ruptures does the fault get longer,,askscience,1dvwsuc
why does a single proton change everything about an element and its properties,,explainlikeimfive,coveko
how did the restaurant industry convince the american population to pay their employees for them,where did we buy into the tip system,explainlikeimfive,6pk7rz
ask anything wednesday  engineering mathematics computer science,welcome to our weekly feature ask anything wednesday  this week we are focusing on engineering mathematics computer science do you have a question within these topics you werent sure was worth submitting is something a bit too speculative for a typical raskscience post no question is too big or small for aaw in this thread you can ask any sciencerelated question things like what would happen if how will the future if all the rules for x were different why does my asking questions please post your question as a toplevel response to this and our team of panellists will be here to answer and discuss your questions the other topic areas will appear in future ask anything wednesdays so if you have other questions not covered by this weeks theme please either hold on to it until those topics come around or go and post over in our sister subreddit rasksciencediscussion  where every day is ask anything wednesday offtheme questions in this post will be removed to try and keep the thread a manageable size for both our readers and panellists answering questions please only answer a posted question if you are an expert in the field the full guidelines for posting responses in askscience can be found herehttpwwwredditcomrasksciencewikiindexwikiansweringaskscience in short this is a moderated subreddit and responses which do not meet our quality guidelines will be removed remember peer reviewed sources are always appreciated and anecdotes are absolutely not appropriate in general if your answer begins with i think or ive heard then its not suitable for raskscience if you would like to become a member of the askscience panel please refer to the information provided herehttpswwwredditcomraskscienceaboutsticky past askanythingwednesday posts can be found herehttpwwwredditcomrasksciencesearchqflair3a27meta27restrictsronsortnewtall ask away,askscience,1dozb9y
